Barcode,Family,Genus,Species,Subspecies,variety,hybrid,hybrid Author,AnnCODE/VerPers\n/Determiner [Formatted],AnnDate,Collectors [Aggregated],Collector's No.,date,year,month,COLLDATE (Day),Country,State,County,PLACE,NA_NAME,CITY,CITYTYPE,Lat1text,Long1text,T1,R1,S1,NSEW_1,T2,R2,S2,NSEW_2,ELEV,Habitat,Habitat _Misc,notes,Latitude1,Longitude1,Latitude2,Longitude2,Geo Ref Compiled By [Formatted],Geo Ref Remarks,Protocol,Source,UncertaintyEst,Uncertainty Est Unit,scientific_name,FOCUS
v0000290WIS,Orchidaceae,Arethusa,bulbosa,,,,,"Case, Fred",1983,"Sieker, William; Sieker, George",s.n.,6/23/35,1935,6,23,United States,Wisconsin,Ozaukee,"""Cedarburg Swamp""",Cedarburg Bog State Natural Area,Cedarburg,C,43.382170 N,88.010000 W,,,,,,,,,,,,,43.38217,-88.01,,,,,Georeferencing Quick Reference Guide 2012-10-02,Geolocate,3047,m,Arethusa bulbosa,Yes
v0000770WIS,Orchidaceae,Cypripedium,acaule,,,,,"Case, Fred",1983,"Sieker, William; Sieker, George",s.n.,6/8/31,1931,6,8,United States,Wisconsin,Ozaukee,"""Cedarburg Swamp""",Cedarburg Bog State Natural Area,,,43.382170 N,88.010000 W,,,,,,,,,,swamp,,,43.38217,-88.01,,,,,Georeferencing Quick Reference Guide 2012-10-02,Geolocate,3047,m,Cypripedium acaule,Yes
v0000182WIS,Orchidaceae,Cypripedium,parviflorum,,pubescens,,,"Case, Martha",Jun-93,"Sieker, George; Sieker, William",s.n.,6/5/31,1931,6,5,United States,Wisconsin,Milwaukee,"""Donges Bay - Milw. Co."" [near Bayside]",Donges Bay Gorge,Bayside,,,,,,,,,,,,,Deep woodlands.,,,,,,,,,,,,,Cypripedium parviflorum pubescens,Yes
v0000771WIS,Orchidaceae,Cypripedium,acaule,,,,,"Case, Fred",1983,"Wing, Gordon; Sieker, George",s.n.,6/5/34,1934,6,5,United States,Wisconsin,Jefferson,"""Hope Lake Bog""",,,,,,,,,,,,,,,bog,,,,,,,,,,,,,Cypripedium acaule,Yes
v0019912WIS,Orchidaceae,Cypripedium,parviflorum,,pubescens,,,,,"Meyer, Thomas",s.n.,5/25/85,1985,5,25,United States,Wisconsin,Walworth,"""Pell Lake Railroad Prairie""",Pell Lake Railroad Prairie,,,,,01N,18E,8,SE4,,,,,,"ROW of former railroad, E side. Overgrown wet-mesic prairie and sedge meadow.",BER. Oone clump. [year of collection in doubt],,42.55644034,-88.38865338,,,,"Latitude/Longitude was derived from the Township, Range, Section location. This causes an imprecision.",,"GEODISC 2.1 WI Dept. of Natl. Res., Geographic Services Section",569,m,Cypripedium parviflorum pubescens,Yes
v0000697WIS,Orchidaceae,Cypripedium,acaule,,,,,"Case, Fred",1963,"Cheney, L.",s.n.,6/4/25,1925,6,4,United States,Wisconsin,Waukesha,"[probably SW of Mukwanago, J.T.C.]",,,,,,,,,,,,,,,,"written to the side of the label says, Probably SW of Mukwonago, Waukesha Co.",,,,,,,,,,,,Cypripedium acaule,Yes
v0000221WIS,Orchidaceae,Aplectrum,hyemale,,,,,"Case, Fred",1963,"Elser, Harold",s.n.,5/2/42,1942,5,2,United States,Wisconsin,Ozaukee,1 mi. S of Saukville,,Saukville,V,43.367430 N,87.947170 W,,,,,,,,,,,,,43.36743,-87.94717,,,,,Georeferencing Quick Reference Guide 2012-10-02,Geolocate,1871,m,Aplectrum hyemale,Yes
v0001735WIS,Orchidaceae,Platanthera,huronensis,,,,,"Case, Fred",1961,"Iltis, Hugh; Koeppen, Robert",8219,9/10/56,1956,9,10,United States,Wisconsin,Sheboygan,2 mi E of Cedar Grove,,Cedar Grove,V,,,13N,23E,30,,,,,,,"Moist mossy swale (depression) inland of first dune (Juncus balticus, Galium trifidum, G. brevipes)",,,43.56543743,-87.7948027,,,,"Latitude/Longitude was derived from the Township, Range, Section location. This causes an imprecision.",,"GEODISC 2.1 WI Dept. of Natl. Res., Geographic Services Section",1138,m,Platanthera huronensis,No
v0001233WIS,Orchidaceae,Epipactis,helleborine,,,,,,,"Spuhler, Daniel",93-211,8/1/93,1993,8,1,United States,Wisconsin,Washington,2 mi E of Hartford,,Hartford,C,,,10N,18E,14,S2,,,,,,"railroad right-of-way. Mesic upland. Quercus ssp., Tilia americana, Cornus racemosa, Elytrigia repens.",rare,,43.33191712,-88.32897839,,,,"Latitude/Longitude was derived from the Township, Range, Section location. This causes an imprecision.",,"GEODISC 2.1 WI Dept. of Natl. Res., Geographic Services Section",1138,m,Epipactis helleborine,No
v0001799WIS,Orchidaceae,Platanthera,lacera,,,,,"Case, Fred",1961,"Thomson, John",s.n.,7/29/40,1940,7,29,United States,Wisconsin,Walworth,2 mi NE Lake Geneva,,Lake Geneva,C,,,02N,18E,20,,,,,,,in tamarack bog,,,42.61837035,-88.39421753,,,,"Latitude/Longitude was derived from the Township, Range, Section location. This causes an imprecision.",,"GEODISC 2.1 WI Dept. of Natl. Res., Geographic Services Section",1138,m,Platanthera lacera,Yes
v0057437WIS,Orchidaceae,Calopogon,tuberosus,,tuberosus,,,"Goldman, D.",7/2/99,"Thomson, John",s.n.,7/12/41,1941,7,12,United States,Wisconsin,Walworth,2 mi. NE of Lake Geneva.,,Lake Geneva,,,,,,,,,,,,,In tamarack bog.,,,,,,,,,,,,,Calopogon tuberosus tuberosus,Yes
v0000641WIS,Orchidaceae,Epipactis,helleborine,,,,,,,"Aussem, Daniel",220,7/13/94,1994,7,13,United States,Wisconsin,Milwaukee,"2120 W. Applewoods, WI 53209",,Glendale,C,,,08N,22E,18,,,,,,,"On front lawn of residential home, in garden freeform under shade of planted Betula. Weedy among Astilbe, Salvia, Chrysanthemun Disturbed soil of urban neighborhood, growing in woodchips. Soil rich black topsoil; medium shade; no slope.","Common, Deep roots; undesired; owner pulling them out as weeds.",,43.15545517,-87.93531609,,,,"Latitude/Longitude was derived from the Township, Range, Section location. This causes an imprecision.",,"GEODISC 2.1 WI Dept. of Natl. Res., Geographic Services Section",1138,m,Epipactis helleborine,No
v0002138WIS,Orchidaceae,Liparis,loeselii,,,,,"Case, Fred",2/12/62,"Butler, John",s.n.,6/25/53,1953,6,25,United States,Wisconsin,Kenosha,2mi S of Kenosha,,Kenosha,C,,,01N,23E,29,,,,,,,"Sandy loam, in an oak opening, 8' from nearest oak.",,,42.51389052,-87.81179537,,,,"Latitude/Longitude was derived from the Township, Range, Section location. This causes an imprecision.",,"GEODISC 2.1 WI Dept. of Natl. Res., Geographic Services Section",1138,m,Liparis loeselii,No
v0000814WIS,Orchidaceae,Cypripedium,parviflorum,,makasin,,,"Case, Fred",8/10/83,"Linderud, David",19,5/26/73,1973,5,26,United States,Wisconsin,Walworth,2mi W of Genoa City,,Genoa City,V,,,01N,18E,33,,,,,,,Edge of woods and marsh.,Uncommon. Petals yellow.,BER2004. ,,,,,,,,,,,Cypripedium parviflorum makasin,Yes
v0002610WIS,Orchidaceae,Spiranthes,cernua,,,,,"Case, Fred",1983,"Iltis, Hugh; Koeppen, Robert",8262,9/10/56,1956,9,10,United States,Wisconsin,Sheboygan,2mi. E of Cedar Grove. Lake Michigan,,Cedar Grove,V,,,13N,23E,30,,,,,,,"Sandy flats, ancient beach of lake, about 200-400 yds. from present shore",,,43.56543743,-87.7948027,,,,"Latitude/Longitude was derived from the Township, Range, Section location. This causes an imprecision.",,"GEODISC 2.1 WI Dept. of Natl. Res., Geographic Services Section",1138,m,Spiranthes cernua,No
v0001777WIS,Orchidaceae,Platanthera,lacera,,,,,"Case, Fred",1961,"Lapham, I.",s.n.,06/30/1855,1855,6,30,United States,Wisconsin,Waukesha,3 mi. W of Oconomowoc,,,,,,,,,,,,,,,Cranberry marsh.,,,,,,,,,,,,,Platanthera lacera,Yes
v0002426WIS,Orchidaceae,Pogonia,ophioglossoides,,,,,"Case, Fred",1963,"Heddle, J.",s.n.,06/30/1855,1855,6,30,United States,Wisconsin,Waukesha,3mi N of Oconomowoc,,Oconomowoc,C,,,,,,,,,,,,cranberry marsh.,collector name by editor,,,,,,,,,,,,Pogonia ophioglossoides,Yes
v0000216WIS,Orchidaceae,Aplectrum,hyemale,,,,,"Case, Fred",1983,"Iltis, Hugh",21794,Oct-63,1963,10,,United States,Wisconsin,Ozaukee,4 mi. W of Saukville; Cedarburg Bog (Univ. Wisc. Milwaukee) Biological Area,Cedarburg Bog State Natural Area,Saukville,V,,,11N,21E,30,,,,,,,Mature rich mesic upland Fagus grandifolia-Acer saccaharum- Tilia americana woods.,,,,,,,,,,,,,Aplectrum hyemale,Yes
v0001018WIS,Orchidaceae,Cypripedium,candidum,,,,,"Case, Fred",1963,"Fernholz, D.",s.n.,5/21/30,1930,5,21,United States,Wisconsin,Jefferson,6.5mi NE of Milton,,,,,,,,,,,,,,,marsh,,,,,,,,,,,,,Cypripedium candidum,Yes
v0002689WIS,Orchidaceae,Spiranthes,magnicamporum,,,,,"Case, Fred",1983,"Harshbarger, Nancy",s.n.,10/1/66,1966,10,1,United States,Wisconsin,Kenosha,"8mi. S of Kenosha next to Lake Michigan, Chiwaukee Prairie",Chiwaukee Prairie State Natural Area,,,,,01N,23E,31,,,,,,,Prairie.,BER.,,42.50015862,-87.82359307,,,,"Latitude/Longitude was derived from the Township, Range, Section location. This causes an imprecision.",,"GEODISC 2.1 WI Dept. of Natl. Res., Geographic Services Section",1138,m,Spiranthes magnicamporum,No
v0001217WIS,Orchidaceae,Coeloglossum,viride,,virescens,,,"Cochrane, Theodore",5/23/83,"Moore, Gwen; Cochrane, Theodore; Cochrane, Barbara",437,7/5/82,1982,7,5,United States,Wisconsin,Racine,"Along N side of W Tichigan Rd., 4mi N of Waterford, Van Walin woods- SE4 or SW4 of section 2",,Waterford,V,,,04N,19E,2,,,,,,,Sugar maple-red oak woods now being cut.,,,42.83554982,-88.21769279,,,,"Latitude/Longitude was derived from the Township, Range, Section location. This causes an imprecision.",,"GEODISC 2.1 WI Dept. of Natl. Res., Geographic Services Section",1138,m,Coeloglossum viride virescens,No
v0000963WIS,Orchidaceae,Cypripedium,parviflorum,,pubescens,,,"Case, Martha",Jun-93,"Wadmond, S.",s.n.,5/2/01,1901,5,2,United States,Wisconsin,Kenosha,"along Pike creek, near Somers",Pike River Bottomland Woods,,,,,,,,,,,,,,Mesophyes woods.,,,,,,,,,,,,,Cypripedium parviflorum pubescens,Yes
v0340791WIS,Orchidaceae,Cypripedium,parviflorum,,,,,"Atwood, John",11/19/83,"Wadmond, S.",1480,6/5/26,1926,6,5,United States,Wisconsin,Sheboygan,Along S. T. H. 57,,,,,,,,,,,,,,,,,,,,,,,,,,,,Cypripedium parviflorum,No
v0002103WIS,Orchidaceae,Liparis,loeselii,,,,,"Case, Fred",1983,"Cochrane, Theodore",5956,10/22/73,1973,10,22,United States,Wisconsin,Walworth,along White R. Playboy Club property 0.75mi NE of Lake Geneva,,Lake Geneva,C,,,02N,18E,30,,,,,,,"mossy ground, with evident moisture on fallen oak leaves; dense white oak-hickory savanna, formerly grazed, now mostly Lonicera thickets with Achilles, Prunella, Plantago, Potentilla recta in grassy openings. Gravelly loam ridge, E-facing slope.",3 plants,,42.60398877,-88.41387357,,,,"Latitude/Longitude was derived from the Township, Range, Section location. This causes an imprecision.",,"GEODISC 2.1 WI Dept. of Natl. Res., Geographic Services Section",1138,m,Liparis loeselii,No
v0002100WIS,Orchidaceae,Liparis,loeselii,,,,,"Case, Fred",1983,"Hansen, Bruce; Tans, William",3576,8/14/75,1975,8,14,United States,Wisconsin,Walworth,"around Lulu Lake, 2mi NNE of Troy Center",Lulu Lake and Eagle Spring Lake Wetland Complex and Adjacent Uplands,Troy Center,,,,04N,17E,2,SW4NE4,,,,,,"Large calcareous marsh and sedge meadow. Additonal species: Fen areas around the shore of the lake, slightly higher in elevation than the surrounding sedge meadow, with Pycnanthemum virginianum, Cladium mariscoides, Rhynchospora alba, R. capillacea, Triglochin maritimum, Aster umbellatus, Solidago ohiensis, Oxypolis rigidior, Lobella kaimii, Drosera rotundifolia, Potentilla frutidosa, Saix serissima, Carex stricta, Calamagrostis canadensis",,,42.8378749,-88.45149183,,,,"Latitude/Longitude was derived from the Township, Range, Section location. This causes an imprecision.",,"GEODISC 2.1 WI Dept. of Natl. Res., Geographic Services Section",285,m,Liparis loeselii,No
v0001629WIS,Orchidaceae,Platanthera,huronensis,,,,,,,"Spuhler, Daniel",93-385,9/17/93,1993,9,17,United States,Wisconsin,Washington,At north end of Gilbert Lake,Gilbert Lake Wetlands and Uplands,,,,,11N,19E,17,S2NW4SW4,11N,19E,20,NW4,,"Larix larciana swamp, Carex spp., Sphagnum spp., Rhus vernix.",rare,,43.42035533,-88.25103415,,,,"Latitude/Longitude was derived from the Township, Range, Section location. This causes an imprecision.",,"GEODISC 2.1 WI Dept. of Natl. Res., Geographic Services Section",1138,m,Platanthera huronensis,No
v0002543WIS,Orchidaceae,Spiranthes,cernua,,,,,"Case, Fred",1983,"Burger, George",16,8/21/55,1955,8,21,United States,Wisconsin,Jefferson,"Bark River Game Preserve, 2 mi. S of Sullivan",,,,,,06N,16E,13,,,,,,,Sedge-goldenrod peat marsh.,rare,,42.98184352,-88.55157222,,,,"Latitude/Longitude was derived from the Township, Range, Section location. This causes an imprecision.",,"GEODISC 2.1 WI Dept. of Natl. Res., Geographic Services Section",1138,m,Spiranthes cernua,No
v0002471WIS,Orchidaceae,Spiranthes,cernua,,,S. magnicamporum,Sheviak,"Sheviak, C.",Oct-74,"Heddle, J.",179,5-Sep,1905,9,,United States,Wisconsin,Racine,Barker St. Lake Michigan,,Racine,C,42.738090 N,87.782220 W,,,,,,,,,,Moist depression in upper part of sandy beach of lake at base of bluff.,,,42.73809,-87.78222,,,,,Georeferencing Quick Reference Guide 2012-10-02,Geolocate,722,m,Spiranthes cernua,No
v0002616WIS,Orchidaceae,Spiranthes,cernua,,,,,"Case, Fred",1983,"Wadmond, S.",1532,05/09/1897,1897,5,9,United States,Wisconsin,Racine,Barnes Prairie,,Mount Pleasant,T,,,,,,,,,,,,,,,,,,,,,,,,,Spiranthes cernua,No
v0002685WIS,Orchidaceae,Spiranthes,magnicamporum,,,,,"Case, Fred",1983,"Wadmond, S.",s.n.,05/09/1897,1897,5,9,United States,Wisconsin,Racine,Barnes Prairie,,Mount Pleasant,T,,,,,,,,,,,,,BER.,,,,,,,,,,,,Spiranthes magnicamporum,No
v0000878WIS,Orchidaceae,Cypripedium,parviflorum,,pubescens,,,"Case, Martha",Jun-93,"Fuller, Anna",41,06/05/1892,1892,6,5,United States,Wisconsin,Walworth,Bass Lake [SE corner of Whitewater Twp.],,,,,,04N,15E,,,,,,,,,,"Mrs. Fuller, a native of Whitewater, Wisconsin, made a collection of 89 specimens in 1892.  These specimens came from in and around Whitewater and are mostly therefore from Walworth County, although some may have been collected nearby in Jefferson or Rock Counties. Mrs. Fuller gave her herbarium to Mrs. Joe Thiele, who gave it to Miss Lilah Eberle, who in turn gave it to Mrs. Stephens. Donated to the University of Wisconsin Herbarium by Mrs. Florence G. Stephens on February 21, 1977.",,,,,,,,,,,Cypripedium parviflorum pubescens,Yes
v0002688WIS,Orchidaceae,Spiranthes,magnicamporum,,,,,"Case, Fred",1983,"McCown, Deborah",s.n.,9/24/68,1968,9,24,United States,Wisconsin,Kenosha,Beach near and parallel to 7th Ave. Lake Michigan,,,,,,01N,23E,17,,,,,,,"Sandy, raised area adjacent to a low wet area; in the lake sand dunes.",BER. Grass association.,,42.54472085,-87.8140424,,,,"Latitude/Longitude was derived from the Township, Range, Section location. This causes an imprecision.",,"GEODISC 2.1 WI Dept. of Natl. Res., Geographic Services Section",1138,m,Spiranthes magnicamporum,No
v0001739WIS,Orchidaceae,Platanthera,huronensis,,,,,"Case, Fred",1961,"Heddle, J.",299,8/28/06,1906,8,28,United States,Wisconsin,Racine,"Between ""the island"" & the Spring St. road, Root River Valley",Root River Riverine Forest,Racine,C,42.731780 N,87.811970 W,,,,,,,,,,Damp brushwood-wooded bank or low bluff of w-side of valley.,Question mark by August,,42.73178,-87.81197,,,,,Georeferencing Quick Reference Guide 2012-10-02,Geolocate,985,m,Platanthera huronensis,No
v0001729WIS,Orchidaceae,Platanthera,huronensis,,,,,"Case, Fred",1961,"Cull, Irene",625,6/22/46,1946,6,22,United States,Wisconsin,Waukesha,Between Hartland and Pewaukee,,,,,,07N,18E,1,NW4SW4,,,,,,"Prairie (wet), growing with Polygala senega L..",Northern Green Orchid,,43.09524661,-88.32069858,,,,"Latitude/Longitude was derived from the Township, Range, Section location. This causes an imprecision.",,"GEODISC 2.1 WI Dept. of Natl. Res., Geographic Services Section",285,m,Platanthera huronensis,No
v0001729WIS,Orchidaceae,Platanthera,huronensis,,,,,"Case, Fred",1961,"Cull, Irene",625,6/22/46,1946,6,22,United States,Wisconsin,Waukesha,Between Hartland and Pewaukee,,,,,,07N,18E,1,NW4SW4,,,,,,"Prairie (wet), growing with Polygala senega L..",Northern Green Orchid,,43.09524661,-88.32069858,,,,"Latitude/Longitude was derived from the Township, Range, Section location. This causes an imprecision.",,"GEODISC 2.1 WI Dept. of Natl. Res., Geographic Services Section",285,m,Platanthera huronensis,No
v0001729WIS,Orchidaceae,Platanthera,huronensis,,,,,"Case, Fred",1961,"Cull, Irene",625,6/22/46,1946,6,22,United States,Wisconsin,Waukesha,Between Hartland and Pewaukee,,,,,,07N,18E,1,NW4SW4,,,,,,"Prairie (wet), growing with Polygala senega L..",Northern Green Orchid,,43.09524661,-88.32069858,,,,"Latitude/Longitude was derived from the Township, Range, Section location. This causes an imprecision.",,"GEODISC 2.1 WI Dept. of Natl. Res., Geographic Services Section",285,m,Platanthera huronensis,No
v0001729WIS,Orchidaceae,Platanthera,huronensis,,,,,"Case, Fred",1961,"Cull, Irene",625,6/22/46,1946,6,22,United States,Wisconsin,Waukesha,Between Hartland and Pewaukee,,,,,,07N,18E,1,NW4SW4,,,,,,"Prairie (wet), growing with Polygala senega L..",Northern Green Orchid,,43.09524661,-88.32069858,,,,"Latitude/Longitude was derived from the Township, Range, Section location. This causes an imprecision.",,"GEODISC 2.1 WI Dept. of Natl. Res., Geographic Services Section",285,m,Platanthera huronensis,No
v0001729WIS,Orchidaceae,Platanthera,huronensis,,,,,"Case, Fred",1961,"Cull, Irene",625,6/22/46,1946,6,22,United States,Wisconsin,Waukesha,Between Hartland and Pewaukee,,,,,,07N,18E,1,NW4SW4,,,,,,"Prairie (wet), growing with Polygala senega L..",Northern Green Orchid,,43.09524661,-88.32069858,,,,"Latitude/Longitude was derived from the Township, Range, Section location. This causes an imprecision.",,"GEODISC 2.1 WI Dept. of Natl. Res., Geographic Services Section",285,m,Platanthera huronensis,No
v0001729WIS,Orchidaceae,Platanthera,huronensis,,,,,"Case, Fred",1961,"Cull, Irene",625,6/22/46,1946,6,22,United States,Wisconsin,Waukesha,Between Hartland and Pewaukee,,,,,,07N,18E,1,NW4SW4,,,,,,"Prairie (wet), growing with Polygala senega L..",Northern Green Orchid,,43.09524661,-88.32069858,,,,"Latitude/Longitude was derived from the Township, Range, Section location. This causes an imprecision.",,"GEODISC 2.1 WI Dept. of Natl. Res., Geographic Services Section",285,m,Platanthera huronensis,No
v0001729WIS,Orchidaceae,Platanthera,huronensis,,,,,"Case, Fred",1961,"Cull, Irene",625,6/22/46,1946,6,22,United States,Wisconsin,Waukesha,Between Hartland and Pewaukee,,,,,,07N,18E,1,NW4SW4,,,,,,"Prairie (wet), growing with Polygala senega L..",Northern Green Orchid,,43.09524661,-88.32069858,,,,"Latitude/Longitude was derived from the Township, Range, Section location. This causes an imprecision.",,"GEODISC 2.1 WI Dept. of Natl. Res., Geographic Services Section",285,m,Platanthera huronensis,No
v0001729WIS,Orchidaceae,Platanthera,huronensis,,,,,"Case, Fred",1961,"Cull, Irene",625,6/22/46,1946,6,22,United States,Wisconsin,Waukesha,Between Hartland and Pewaukee,,,,,,07N,18E,1,NW4SW4,,,,,,"Prairie (wet), growing with Polygala senega L..",Northern Green Orchid,,43.09524661,-88.32069858,,,,"Latitude/Longitude was derived from the Township, Range, Section location. This causes an imprecision.",,"GEODISC 2.1 WI Dept. of Natl. Res., Geographic Services Section",285,m,Platanthera huronensis,No
v0001729WIS,Orchidaceae,Platanthera,huronensis,,,,,"Case, Fred",1961,"Cull, Irene",625,6/22/46,1946,6,22,United States,Wisconsin,Waukesha,Between Hartland and Pewaukee,,,,,,07N,18E,1,NW4SW4,,,,,,"Prairie (wet), growing with Polygala senega L..",Northern Green Orchid,,43.09524661,-88.32069858,,,,"Latitude/Longitude was derived from the Township, Range, Section location. This causes an imprecision.",,"GEODISC 2.1 WI Dept. of Natl. Res., Geographic Services Section",285,m,Platanthera huronensis,No
v0001731WIS,Orchidaceae,Platanthera,huronensis,,,,,"Case, Fred",1961,"Cull, Irene",637,6/22/46,1946,6,22,United States,Wisconsin,Waukesha,Between Hartland and Pewaukee,,,,,,07N,18E,1,NW4SW4,,,,,,"black loam and cinders, growing with Polygala senega in moist soil along railroad",,,43.09524661,-88.32069858,,,,"Latitude/Longitude was derived from the Township, Range, Section location. This causes an imprecision.",,"GEODISC 2.1 WI Dept. of Natl. Res., Geographic Services Section",285,m,Platanthera huronensis,No
v0001731WIS,Orchidaceae,Platanthera,huronensis,,,,,"Case, Fred",1961,"Cull, Irene",637,6/22/46,1946,6,22,United States,Wisconsin,Waukesha,Between Hartland and Pewaukee,,,,,,07N,18E,1,NW4SW4,,,,,,"black loam and cinders, growing with Polygala senega in moist soil along railroad",,,43.09524661,-88.32069858,,,,"Latitude/Longitude was derived from the Township, Range, Section location. This causes an imprecision.",,"GEODISC 2.1 WI Dept. of Natl. Res., Geographic Services Section",285,m,Platanthera huronensis,No
v0001731WIS,Orchidaceae,Platanthera,huronensis,,,,,"Case, Fred",1961,"Cull, Irene",637,6/22/46,1946,6,22,United States,Wisconsin,Waukesha,Between Hartland and Pewaukee,,,,,,07N,18E,1,NW4SW4,,,,,,"black loam and cinders, growing with Polygala senega in moist soil along railroad",,,43.09524661,-88.32069858,,,,"Latitude/Longitude was derived from the Township, Range, Section location. This causes an imprecision.",,"GEODISC 2.1 WI Dept. of Natl. Res., Geographic Services Section",285,m,Platanthera huronensis,No
v0001731WIS,Orchidaceae,Platanthera,huronensis,,,,,"Case, Fred",1961,"Cull, Irene",637,6/22/46,1946,6,22,United States,Wisconsin,Waukesha,Between Hartland and Pewaukee,,,,,,07N,18E,1,NW4SW4,,,,,,"black loam and cinders, growing with Polygala senega in moist soil along railroad",,,43.09524661,-88.32069858,,,,"Latitude/Longitude was derived from the Township, Range, Section location. This causes an imprecision.",,"GEODISC 2.1 WI Dept. of Natl. Res., Geographic Services Section",285,m,Platanthera huronensis,No
v0001731WIS,Orchidaceae,Platanthera,huronensis,,,,,"Case, Fred",1961,"Cull, Irene",637,6/22/46,1946,6,22,United States,Wisconsin,Waukesha,Between Hartland and Pewaukee,,,,,,07N,18E,1,NW4SW4,,,,,,"black loam and cinders, growing with Polygala senega in moist soil along railroad",,,43.09524661,-88.32069858,,,,"Latitude/Longitude was derived from the Township, Range, Section location. This causes an imprecision.",,"GEODISC 2.1 WI Dept. of Natl. Res., Geographic Services Section",285,m,Platanthera huronensis,No
v0001731WIS,Orchidaceae,Platanthera,huronensis,,,,,"Case, Fred",1961,"Cull, Irene",637,6/22/46,1946,6,22,United States,Wisconsin,Waukesha,Between Hartland and Pewaukee,,,,,,07N,18E,1,NW4SW4,,,,,,"black loam and cinders, growing with Polygala senega in moist soil along railroad",,,43.09524661,-88.32069858,,,,"Latitude/Longitude was derived from the Township, Range, Section location. This causes an imprecision.",,"GEODISC 2.1 WI Dept. of Natl. Res., Geographic Services Section",285,m,Platanthera huronensis,No
v0001731WIS,Orchidaceae,Platanthera,huronensis,,,,,"Case, Fred",1961,"Cull, Irene",637,6/22/46,1946,6,22,United States,Wisconsin,Waukesha,Between Hartland and Pewaukee,,,,,,07N,18E,1,NW4SW4,,,,,,"black loam and cinders, growing with Polygala senega in moist soil along railroad",,,43.09524661,-88.32069858,,,,"Latitude/Longitude was derived from the Township, Range, Section location. This causes an imprecision.",,"GEODISC 2.1 WI Dept. of Natl. Res., Geographic Services Section",285,m,Platanthera huronensis,No
v0001731WIS,Orchidaceae,Platanthera,huronensis,,,,,"Case, Fred",1961,"Cull, Irene",637,6/22/46,1946,6,22,United States,Wisconsin,Waukesha,Between Hartland and Pewaukee,,,,,,07N,18E,1,NW4SW4,,,,,,"black loam and cinders, growing with Polygala senega in moist soil along railroad",,,43.09524661,-88.32069858,,,,"Latitude/Longitude was derived from the Township, Range, Section location. This causes an imprecision.",,"GEODISC 2.1 WI Dept. of Natl. Res., Geographic Services Section",285,m,Platanthera huronensis,No
v0001731WIS,Orchidaceae,Platanthera,huronensis,,,,,"Case, Fred",1961,"Cull, Irene",637,6/22/46,1946,6,22,United States,Wisconsin,Waukesha,Between Hartland and Pewaukee,,,,,,07N,18E,1,NW4SW4,,,,,,"black loam and cinders, growing with Polygala senega in moist soil along railroad",,,43.09524661,-88.32069858,,,,"Latitude/Longitude was derived from the Township, Range, Section location. This causes an imprecision.",,"GEODISC 2.1 WI Dept. of Natl. Res., Geographic Services Section",285,m,Platanthera huronensis,No
v0002698WIS,Orchidaceae,Spiranthes,magnicamporum,,,,,"Case, Fred",1983,"Cull, Irene",781a,9/14/46,1946,9,14,United States,Wisconsin,Waukesha,Between Hartland and Pewaukee,,,,,,07N,18E,1,NE4SW4,,,,,,"Moist black soil, with Gentiana procera along railroad.",BER.,,43.09524432,-88.31587204,,,,"Latitude/Longitude was derived from the Township, Range, Section location. This causes an imprecision.",,"GEODISC 2.1 WI Dept. of Natl. Res., Geographic Services Section",285,m,Spiranthes magnicamporum,No
v0002698WIS,Orchidaceae,Spiranthes,magnicamporum,,,,,"Case, Fred",1983,"Cull, Irene",781a,9/14/46,1946,9,14,United States,Wisconsin,Waukesha,Between Hartland and Pewaukee,,,,,,07N,18E,1,NE4SW4,,,,,,"Moist black soil, with Gentiana procera along railroad.",BER.,,43.09524432,-88.31587204,,,,"Latitude/Longitude was derived from the Township, Range, Section location. This causes an imprecision.",,"GEODISC 2.1 WI Dept. of Natl. Res., Geographic Services Section",285,m,Spiranthes magnicamporum,No
v0002698WIS,Orchidaceae,Spiranthes,magnicamporum,,,,,"Case, Fred",1983,"Cull, Irene",781a,9/14/46,1946,9,14,United States,Wisconsin,Waukesha,Between Hartland and Pewaukee,,,,,,07N,18E,1,NE4SW4,,,,,,"Moist black soil, with Gentiana procera along railroad.",BER.,,43.09524432,-88.31587204,,,,"Latitude/Longitude was derived from the Township, Range, Section location. This causes an imprecision.",,"GEODISC 2.1 WI Dept. of Natl. Res., Geographic Services Section",285,m,Spiranthes magnicamporum,No
v0002698WIS,Orchidaceae,Spiranthes,magnicamporum,,,,,"Case, Fred",1983,"Cull, Irene",781a,9/14/46,1946,9,14,United States,Wisconsin,Waukesha,Between Hartland and Pewaukee,,,,,,07N,18E,1,NE4SW4,,,,,,"Moist black soil, with Gentiana procera along railroad.",BER.,,43.09524432,-88.31587204,,,,"Latitude/Longitude was derived from the Township, Range, Section location. This causes an imprecision.",,"GEODISC 2.1 WI Dept. of Natl. Res., Geographic Services Section",285,m,Spiranthes magnicamporum,No
v0002698WIS,Orchidaceae,Spiranthes,magnicamporum,,,,,"Case, Fred",1983,"Cull, Irene",781a,9/14/46,1946,9,14,United States,Wisconsin,Waukesha,Between Hartland and Pewaukee,,,,,,07N,18E,1,NE4SW4,,,,,,"Moist black soil, with Gentiana procera along railroad.",BER.,,43.09524432,-88.31587204,,,,"Latitude/Longitude was derived from the Township, Range, Section location. This causes an imprecision.",,"GEODISC 2.1 WI Dept. of Natl. Res., Geographic Services Section",285,m,Spiranthes magnicamporum,No
v0002698WIS,Orchidaceae,Spiranthes,magnicamporum,,,,,"Case, Fred",1983,"Cull, Irene",781a,9/14/46,1946,9,14,United States,Wisconsin,Waukesha,Between Hartland and Pewaukee,,,,,,07N,18E,1,NE4SW4,,,,,,"Moist black soil, with Gentiana procera along railroad.",BER.,,43.09524432,-88.31587204,,,,"Latitude/Longitude was derived from the Township, Range, Section location. This causes an imprecision.",,"GEODISC 2.1 WI Dept. of Natl. Res., Geographic Services Section",285,m,Spiranthes magnicamporum,No
v0002698WIS,Orchidaceae,Spiranthes,magnicamporum,,,,,"Case, Fred",1983,"Cull, Irene",781a,9/14/46,1946,9,14,United States,Wisconsin,Waukesha,Between Hartland and Pewaukee,,,,,,07N,18E,1,NE4SW4,,,,,,"Moist black soil, with Gentiana procera along railroad.",BER.,,43.09524432,-88.31587204,,,,"Latitude/Longitude was derived from the Township, Range, Section location. This causes an imprecision.",,"GEODISC 2.1 WI Dept. of Natl. Res., Geographic Services Section",285,m,Spiranthes magnicamporum,No
v0002698WIS,Orchidaceae,Spiranthes,magnicamporum,,,,,"Case, Fred",1983,"Cull, Irene",781a,9/14/46,1946,9,14,United States,Wisconsin,Waukesha,Between Hartland and Pewaukee,,,,,,07N,18E,1,NE4SW4,,,,,,"Moist black soil, with Gentiana procera along railroad.",BER.,,43.09524432,-88.31587204,,,,"Latitude/Longitude was derived from the Township, Range, Section location. This causes an imprecision.",,"GEODISC 2.1 WI Dept. of Natl. Res., Geographic Services Section",285,m,Spiranthes magnicamporum,No
v0002698WIS,Orchidaceae,Spiranthes,magnicamporum,,,,,"Case, Fred",1983,"Cull, Irene",781a,9/14/46,1946,9,14,United States,Wisconsin,Waukesha,Between Hartland and Pewaukee,,,,,,07N,18E,1,NE4SW4,,,,,,"Moist black soil, with Gentiana procera along railroad.",BER.,,43.09524432,-88.31587204,,,,"Latitude/Longitude was derived from the Township, Range, Section location. This causes an imprecision.",,"GEODISC 2.1 WI Dept. of Natl. Res., Geographic Services Section",285,m,Spiranthes magnicamporum,No
v0002698WIS,Orchidaceae,Spiranthes,magnicamporum,,,,,"Case, Fred",1983,"Cull, Irene",781a,9/14/46,1946,9,14,United States,Wisconsin,Waukesha,Between Hartland and Pewaukee,,,,,,07N,18E,1,NE4SW4,,,,,,"Moist black soil, with Gentiana procera along railroad.",BER.,,43.09524432,-88.31587204,,,,"Latitude/Longitude was derived from the Township, Range, Section location. This causes an imprecision.",,"GEODISC 2.1 WI Dept. of Natl. Res., Geographic Services Section",285,m,Spiranthes magnicamporum,No
v0001656WIS,Orchidaceae,Platanthera,huronensis,,,,,"Case, Fred",1961,"Wadmond, S.",s.n.,7/14/35,1935,7,14,United States,Wisconsin,Waukesha,"between schoolhouse and Wauksowis Farm, edge of village",,Big Bend,V,,,,,,,,,,,,edge of marly pools,,,,,,,,,,,,,Platanthera huronensis,No
v0000703WIS,Orchidaceae,Cypripedium,acaule,,,,,"Case, Fred",1963,,s.n.,06/03/1871,1871,6,3,United States,Wisconsin,Sheboygan,Black River,,Wilson,T,43.659270 N,87.728890 W,,,,,,,,,,Cedar Swamp,,,43.65927,-87.72889,,,,,Georeferencing Quick Reference Guide 2012-10-02,Geolocate,5000,m,Cypripedium acaule,Yes
v0000998WIS,Orchidaceae,Cypripedium,parviflorum,,makasin,,,"Atwood, John",11/19/83,"Wadmond, S.",1480,6/12/27,1927,6,12,United States,Wisconsin,Walworth,Bloomfield Twp.,,,T,,,,,,,,,,,,Larix swamp.,2 specimens + photo.,BER2004. ,,,,,,,,,,,Cypripedium parviflorum makasin,Yes
v0261030WIS,Orchidaceae,Cypripedium,candidum,,,,,,,"Cochrane, Theodore; Smith, S.; Kurowski, Ronald",15157,5/24/10,2010,5,24,United States,Wisconsin,Walworth,"Bluff Creek Prairie, part of Bluff Creek SNA, S side of Bluff Creek N of Hi Lo Rd., 0.4 mi. W of CTH P, 3.7 mi. (airline distance) SE of center of Whitewater.",Bluff Creek Prairie,Whitewater,C,,,04N,15E,23,SW4NW4NE4,,,,,840 ft,"Calcareous lowland prairie; assoc.: Comandra umbellata (very abundant), Chelone glabra (frequent), Fragaria virginiana, Galium boreale (very abundant), Hypoxis hirsuta, Lathyrus palustris, Pycnanthemum virginianum, Smilacina stellata, Viburnum lentago sprouts, and Viola sororia.","Area owned by DNR for a long time, but first managed only 10 yrs. ago (prairie consists of roughly 100 acres, 20--25 acres of which are being managed).",,42.79732102,-88.68748581,,,,"Latitude/Longitude was derived from the Township, Range, Section location. This causes an imprecision.",,"GEODISC 2.1 WI Dept. of Natl. Res., Geographic Services Section",285,m,Cypripedium candidum,Yes
v0261030WIS,Orchidaceae,Cypripedium,candidum,,,,,,,"Cochrane, Theodore; Smith, S.; Kurowski, Ronald",15157,5/24/10,2010,5,24,United States,Wisconsin,Walworth,"Bluff Creek Prairie, part of Bluff Creek SNA, S side of Bluff Creek N of Hi Lo Rd., 0.4 mi. W of CTH P, 3.7 mi. (airline distance) SE of center of Whitewater.",Bluff Creek Prairie,Whitewater,C,,,04N,15E,23,SW4NW4NE4,,,,,840 ft,"Calcareous lowland prairie; assoc.: Comandra umbellata (very abundant), Chelone glabra (frequent), Fragaria virginiana, Galium boreale (very abundant), Hypoxis hirsuta, Lathyrus palustris, Pycnanthemum virginianum, Smilacina stellata, Viburnum lentago sprouts, and Viola sororia.","Area owned by DNR for a long time, but first managed only 10 yrs. ago (prairie consists of roughly 100 acres, 20--25 acres of which are being managed).",,42.79732102,-88.68748581,,,,"Latitude/Longitude was derived from the Township, Range, Section location. This causes an imprecision.",,"GEODISC 2.1 WI Dept. of Natl. Res., Geographic Services Section",285,m,Cypripedium candidum,Yes
v0000173WIS,Orchidaceae,Corallorhiza,odontorhiza,,odontorhiza,,,"Cochrane, Theodore",2/2/94,"Leitner, Lawrence",3466,9/19/89,1989,9,19,United States,Wisconsin,Walworth,Bluff Creek Woods State Natural Area,Bluff Creek Woods,,,,,04N,15E,24,E2NE4,04N,16E,19,NW4,,,,BER2004. Also det. by Jeffrey Hapemen.,,,,,,,,,,,Corallorhiza odontorhiza odontorhiza,No
v0001221WIS,Orchidaceae,Arethusa,bulbosa,,,,,,,"Meyer, Thomas",343,5/26/86,1986,5,26,United States,Wisconsin,Walworth,Bog E of Lulu Lake,Lulu Lake and Eagle Spring Lake Wetland Complex and Adjacent Uplands,,,,,04N,18E,2,SE4SE4NE4,,,,,,"In  pure Sphagnum of floating bog mat surrounding bog pool.  Associates; Carex stricta, C. oligosperma, C. disperma, Larix laricina, Vaccinium myrtilloides, V. macrocarpon, Rhus vernix, Andromeda glaucophylla, Gaylussacia baccata, Chamaedaphne calyculata Menyanthes trifoliata, Drosera rotundifolia, Sarracenia purpurea, Trientalis borealis, Potentilla fruticosa, P. palustris, Betula pumila.",BER. Hundreds of plants in various stages of flower. Full sun. First Walworth County record.,,42.83710418,-88.3286766,,,,"Latitude/Longitude was derived from the Township, Range, Section location. This causes an imprecision.",,"GEODISC 2.1 WI Dept. of Natl. Res., Geographic Services Section",285,m,Arethusa bulbosa,Yes
v0000294WIS,Orchidaceae,Arethusa,bulbosa,,,,,,,"Meyer, Thomas",343,5/26/86,1986,5,26,United States,Wisconsin,Walworth,Bog east of Lulu Lake,Lulu Lake and Eagle Spring Lake Wetland Complex and Adjacent Uplands,,,,,04N,18E,2,SE4SE4NE4,,,,,,"In  pure Sphagnum of floating bog mat surrounding bog pool.  Associates; Carex stricta, C. oligosperma, C. disperma, Larix laricina, Vaccinium myrtilloides, V. macrocarpon, Rhus vernix, Andromeda glaucophylla, Gaylussacia baccata, Chamaedaphne calyculata Menyanthes trifoliata, Drosera rotundifolia, Sarracenia purpurea, Trientalis borealis, Potentilla fruticosa, P. palustris, Betula pumila.",BER2004. Hundreds of plants in various stages of flower. Full sun. First Walworth County record.,,42.83710418,-88.3286766,,,,"Latitude/Longitude was derived from the Township, Range, Section location. This causes an imprecision.",,"GEODISC 2.1 WI Dept. of Natl. Res., Geographic Services Section",285,m,Arethusa bulbosa,Yes
v0000211WIS,Orchidaceae,Aplectrum,hyemale,,,,,"Case, Fred",1963,"Wadmond, S.; Taylor, Mrs. Agen",1467,6/3/34,1934,6,3,United States,Wisconsin,Jefferson,bordering Crawfish River,,Milford,T,,,,,,,,,,,,Low woods bordering river,,,,,,,,,,,,,Aplectrum hyemale,Yes
v0252935WIS,Orchidaceae,Cypripedium,X andrewsii,,,,,,,"Howe, Eric",s.n.,6/8/08,2008,6,8,United States,Wisconsin,Walworth,"Ca. 1 mi. W of Lulu Lake, W of Nature Rd. (= CTH N) between (N of) Bluff Rd. and (just S of) Waukesha Co. line, 5 mi. (airline distance) due NW of East Troy",Lulu Lake and Eagle Spring Lake Wetland Complex and Adjacent Uplands,,,,,04N,17E,3,,,,,,,"Rich black soil. Immediate assoc. include: Caltha palustris, Carex sp., Galium sp., Cornus (racemosa?), Rhamnus frangula, Rhus vernix, Symphyotrichum puniceum, as well as lesser amounts of Calamagrostis canadensis, Lycopus sp., and Rubus pubescens. ",,One plant with two stems in flower and 1 capsule on a stem from 2007 from the same individual. One plant of Cypripedium candidum 3--5 m W of and clump of C. parviflorum var. pubescens 3--4 m E of the C. Xandrewsii plant. Area not burned for many decades.,42.83588395,-88.47359893,,,,"Latitude/Longitude was derived from the Township, Range, Section location. This causes an imprecision.",,"GEODISC 2.1 WI Dept. of Natl. Res., Geographic Services Section",1138,m,Cypripedium X andrewsii,No
v0252935WIS,Orchidaceae,Cypripedium,X andrewsii,,,,,,,"Howe, Eric",s.n.,6/8/08,2008,6,8,United States,Wisconsin,Walworth,"Ca. 1 mi. W of Lulu Lake, W of Nature Rd. (= CTH N) between (N of) Bluff Rd. and (just S of) Waukesha Co. line, 5 mi. (airline distance) due NW of East Troy",Lulu Lake and Eagle Spring Lake Wetland Complex and Adjacent Uplands,,,,,04N,17E,3,,,,,,,"Rich black soil. Immediate assoc. include: Caltha palustris, Carex sp., Galium sp., Cornus (racemosa?), Rhamnus frangula, Rhus vernix, Symphyotrichum puniceum, as well as lesser amounts of Calamagrostis canadensis, Lycopus sp., and Rubus pubescens. ",,One plant with two stems in flower and 1 capsule on a stem from 2007 from the same individual. One plant of Cypripedium candidum 3--5 m W of and clump of C. parviflorum var. pubescens 3--4 m E of the C. Xandrewsii plant. Area not burned for many decades.,42.83588395,-88.47359893,,,,"Latitude/Longitude was derived from the Township, Range, Section location. This causes an imprecision.",,"GEODISC 2.1 WI Dept. of Natl. Res., Geographic Services Section",1138,m,Cypripedium X andrewsii,No
v0252935WIS,Orchidaceae,Cypripedium,X andrewsii,,andrewsii,,,,,"Howe, Eric",s.n.,6/8/08,2008,6,8,United States,Wisconsin,Walworth,"Ca. 1 mi. W of Lulu Lake, W of Nature Rd. (= CTH N) between (N of) Bluff Rd. and (just S of) Waukesha Co. line, 5 mi. (airline distance) due NW of East Troy",Lulu Lake and Eagle Spring Lake Wetland Complex and Adjacent Uplands,,,,,04N,17E,3,,,,,,,"Rich black soil. Immediate assoc. include: Caltha palustris, Carex sp., Galium sp., Cornus (racemosa?), Rhamnus frangula, Rhus vernix, Symphyotrichum puniceum, as well as lesser amounts of Calamagrostis canadensis, Lycopus sp., and Rubus pubescens. ",,One plant with two stems in flower and 1 capsule on a stem from 2007 from the same individual. One plant of Cypripedium candidum 3--5 m W of and clump of C. parviflorum var. pubescens 3--4 m E of the C. Xandrewsii plant. Area not burned for many decades.,42.83588395,-88.47359893,,,,"Latitude/Longitude was derived from the Township, Range, Section location. This causes an imprecision.",,"GEODISC 2.1 WI Dept. of Natl. Res., Geographic Services Section",1138,m,Cypripedium X andrewsii andrewsii,No
v0252935WIS,Orchidaceae,Cypripedium,X andrewsii,,andrewsii,,,,,"Howe, Eric",s.n.,6/8/08,2008,6,8,United States,Wisconsin,Walworth,"Ca. 1 mi. W of Lulu Lake, W of Nature Rd. (= CTH N) between (N of) Bluff Rd. and (just S of) Waukesha Co. line, 5 mi. (airline distance) due NW of East Troy",Lulu Lake and Eagle Spring Lake Wetland Complex and Adjacent Uplands,,,,,04N,17E,3,,,,,,,"Rich black soil. Immediate assoc. include: Caltha palustris, Carex sp., Galium sp., Cornus (racemosa?), Rhamnus frangula, Rhus vernix, Symphyotrichum puniceum, as well as lesser amounts of Calamagrostis canadensis, Lycopus sp., and Rubus pubescens. ",,One plant with two stems in flower and 1 capsule on a stem from 2007 from the same individual. One plant of Cypripedium candidum 3--5 m W of and clump of C. parviflorum var. pubescens 3--4 m E of the C. Xandrewsii plant. Area not burned for many decades.,42.83588395,-88.47359893,,,,"Latitude/Longitude was derived from the Township, Range, Section location. This causes an imprecision.",,"GEODISC 2.1 WI Dept. of Natl. Res., Geographic Services Section",1138,m,Cypripedium X andrewsii andrewsii,No
v0252936WIS,Orchidaceae,Cypripedium,X andrewsii,,,,,,,"Howe, Eric",s.n.,6/8/08,2008,6,8,United States,Wisconsin,Walworth,"Ca. 1 mi. W of Lulu Lake, W of Nature Rd. (= CTH N) between (N of) Bluff Rd. and (just S of) Waukesha Co. line, 5 mi. (airline distance) due NW of East Troy",Lulu Lake and Eagle Spring Lake Wetland Complex and Adjacent Uplands,,,,,04N,17E,3,,,,,,,"Rich black soil. Immediate assoc. include: Caltha palustris, Carex sp., Galium sp., Cornus (racemosa?), Rhamnus frangula, Rhus vernix, Symphyotrichum puniceum, as well as lesser amounts of Calamagrostis canadensis, Lycopus sp., and Rubus pubescens. ",,One plant with two stems in flower and 1 capsule on a stem from 2007 from the same individual. One plant of Cypripedium candidum 3--5 m W of and clump of C. parviflorum var. pubescens 3--4 m E of the C. Xandrewsii. Area not burned for many decades.,42.83588395,-88.47359893,,,,"Latitude/Longitude was derived from the Township, Range, Section location. This causes an imprecision.",,"GEODISC 2.1 WI Dept. of Natl. Res., Geographic Services Section",1138,m,Cypripedium X andrewsii,No
v0252936WIS,Orchidaceae,Cypripedium,X andrewsii,,,,,,,"Howe, Eric",s.n.,6/8/08,2008,6,8,United States,Wisconsin,Walworth,"Ca. 1 mi. W of Lulu Lake, W of Nature Rd. (= CTH N) between (N of) Bluff Rd. and (just S of) Waukesha Co. line, 5 mi. (airline distance) due NW of East Troy",Lulu Lake and Eagle Spring Lake Wetland Complex and Adjacent Uplands,,,,,04N,17E,3,,,,,,,"Rich black soil. Immediate assoc. include: Caltha palustris, Carex sp., Galium sp., Cornus (racemosa?), Rhamnus frangula, Rhus vernix, Symphyotrichum puniceum, as well as lesser amounts of Calamagrostis canadensis, Lycopus sp., and Rubus pubescens. ",,One plant with two stems in flower and 1 capsule on a stem from 2007 from the same individual. One plant of Cypripedium candidum 3--5 m W of and clump of C. parviflorum var. pubescens 3--4 m E of the C. Xandrewsii. Area not burned for many decades.,42.83588395,-88.47359893,,,,"Latitude/Longitude was derived from the Township, Range, Section location. This causes an imprecision.",,"GEODISC 2.1 WI Dept. of Natl. Res., Geographic Services Section",1138,m,Cypripedium X andrewsii,No
v0252936WIS,Orchidaceae,Cypripedium,X andrewsii,,andrewsii,,,,,"Howe, Eric",s.n.,6/8/08,2008,6,8,United States,Wisconsin,Walworth,"Ca. 1 mi. W of Lulu Lake, W of Nature Rd. (= CTH N) between (N of) Bluff Rd. and (just S of) Waukesha Co. line, 5 mi. (airline distance) due NW of East Troy",Lulu Lake and Eagle Spring Lake Wetland Complex and Adjacent Uplands,,,,,04N,17E,3,,,,,,,"Rich black soil. Immediate assoc. include: Caltha palustris, Carex sp., Galium sp., Cornus (racemosa?), Rhamnus frangula, Rhus vernix, Symphyotrichum puniceum, as well as lesser amounts of Calamagrostis canadensis, Lycopus sp., and Rubus pubescens. ",,One plant with two stems in flower and 1 capsule on a stem from 2007 from the same individual. One plant of Cypripedium candidum 3--5 m W of and clump of C. parviflorum var. pubescens 3--4 m E of the C. Xandrewsii. Area not burned for many decades.,42.83588395,-88.47359893,,,,"Latitude/Longitude was derived from the Township, Range, Section location. This causes an imprecision.",,"GEODISC 2.1 WI Dept. of Natl. Res., Geographic Services Section",1138,m,Cypripedium X andrewsii andrewsii,No
v0252936WIS,Orchidaceae,Cypripedium,X andrewsii,,andrewsii,,,,,"Howe, Eric",s.n.,6/8/08,2008,6,8,United States,Wisconsin,Walworth,"Ca. 1 mi. W of Lulu Lake, W of Nature Rd. (= CTH N) between (N of) Bluff Rd. and (just S of) Waukesha Co. line, 5 mi. (airline distance) due NW of East Troy",Lulu Lake and Eagle Spring Lake Wetland Complex and Adjacent Uplands,,,,,04N,17E,3,,,,,,,"Rich black soil. Immediate assoc. include: Caltha palustris, Carex sp., Galium sp., Cornus (racemosa?), Rhamnus frangula, Rhus vernix, Symphyotrichum puniceum, as well as lesser amounts of Calamagrostis canadensis, Lycopus sp., and Rubus pubescens. ",,One plant with two stems in flower and 1 capsule on a stem from 2007 from the same individual. One plant of Cypripedium candidum 3--5 m W of and clump of C. parviflorum var. pubescens 3--4 m E of the C. Xandrewsii. Area not burned for many decades.,42.83588395,-88.47359893,,,,"Latitude/Longitude was derived from the Township, Range, Section location. This causes an imprecision.",,"GEODISC 2.1 WI Dept. of Natl. Res., Geographic Services Section",1138,m,Cypripedium X andrewsii andrewsii,No
v0154946WIS,Orchidaceae,Corallorhiza,odontorhiza,,odontorhiza,,,,,"Spuhler, Daniel",2001-01-A,9/24/01,2001,9,24,United States,Wisconsin,Milwaukee,"Ca. 30--40 m from E edge of woods, Franklin County Park.",Franklin (Puetz Road) Woods,Franklin,C,,,05N,21E,29,SE4NE4SE4,,,,,,"Degraded oak savanna. Assoc.: Quercus macrocarpa, Q. alba, Q. rubra, Agrimonia gryposepala, Crataegus sp., Toxicodendron rydbergii, and Viburnum lentago.","BER2004. Seven stems within 1 sq. ft., four of these flowering, three browsed off. 2001-01-B deposited at Wehr Nature Center, Franklin, WI.",,,,,,,,,,,,Corallorhiza odontorhiza odontorhiza,No
v0000750WIS,Orchidaceae,Cypripedium,acaule,,,,,"Case, Fred",1983,"Curtis, John",s.n.,7/1/32,1932,7,1,United States,Wisconsin,Jefferson,Cambridge,,,,,,,,,,,,,,,Sphagnum bog,,,,,,,,,,,,,Cypripedium acaule,Yes
v0001071WIS,Orchidaceae,Cypripedium,reginae,,,,,"Case, Fred",1983,"Curtis, John",38-29,6/21/38,1938,6,21,United States,Wisconsin,Ozaukee,Cedarburg,Cedarburg Bog State Natural Area,,,,,,,,,,,,,,Cedar thicket.,BER2004. Sheet 1 of 2.,,,,,,,,,,,,Cypripedium reginae,Yes
v0001078WIS,Orchidaceae,Cypripedium,reginae,,,,,"Case, Fred",1983,"Curtis, John",38-29,6/21/38,1938,6,21,United States,Wisconsin,Ozaukee,Cedarburg,Cedarburg Bog State Natural Area,,,,,,,,,,,,,,Cedar thicket.,BER2004. Sheet 2 of 2.,,,,,,,,,,,,Cypripedium reginae,Yes
v0001547WIS,Orchidaceae,Platanthera,dilatata,,dilatata,,,"Case, Fred",1983,"Curtis, John; Kurtenacher, Jane",s.n.,6/23/35,1935,6,23,United States,Wisconsin,Ozaukee,Cedarburg,Cedarburg Bog State Natural Area,,,,,,,,,,,,,,swamp.,"BER2004. [det. label states that plant on sheet is probably P. dilatata, in envelope is clearly P. dilatata].",,,,,,,,,,,,Platanthera dilatata dilatata,Yes
v0001548WIS,Orchidaceae,Platanthera,dilatata,,dilatata,,,"Case, Fred",1983,"Curtis, John; Kurtenacher, Jane",s.n.,7/15/37,1937,7,15,United States,Wisconsin,Ozaukee,Cedarburg,Cedarburg Bog State Natural Area,,,,,,,,,,,,,,,,,,,,,,,,,,,Platanthera dilatata dilatata,Yes
v0001573WIS,Orchidaceae,Platanthera,huronensis,,,,,"Case, Fred",8/10/83,"Curtis, John",38-49,7/10/38,1938,7,10,United States,Wisconsin,Ozaukee,Cedarburg,Cedarburg Bog State Natural Area,,,,,,,,,,,,,,,,,,,,,,,,,,,Platanthera huronensis,No
v0001618WIS,Orchidaceae,Platanthera,hookeri,,,,,"Case, Fred",1983,"Curtis, John; Kurtenacher, Jane",s.n.,5/28/38,1938,5,28,United States,Wisconsin,Ozaukee,Cedarburg,Cedarburg Bog State Natural Area,,,,,,,,,,,,,,,,,,,,,,,,,,,Platanthera hookeri,Yes
v0001662WIS,Orchidaceae,Platanthera,huronensis,,,,,"Case, Fred",1983,"Curtis, John",s.n.,6/21/38,1938,6,21,United States,Wisconsin,Ozaukee,Cedarburg,Cedarburg Bog State Natural Area,,,,,,,,,,,,,,Cedar thicket,,,,,,,,,,,,,Platanthera huronensis,No
v0001783WIS,Orchidaceae,Platanthera,lacera,,,,,,,"Curtis, John; Kurtenacher, Jane",38-27,6/21/38,1938,6,21,United States,Wisconsin,Ozaukee,Cedarburg,Cedarburg Bog State Natural Area,,,,,,,,,,,,,,,,,,,,,,,,,,,Platanthera lacera,Yes
v0001861WIS,Orchidaceae,Platanthera,huronensis,,,,,"Case, Fred",1983,"Curtis, John",38-24,6/21/38,1938,6,21,United States,Wisconsin,Ozaukee,Cedarburg,Cedarburg Bog State Natural Area,,,,,,,,,,,,,,,,,,,,,,,,,,,Platanthera huronensis,No
v0001862WIS,Orchidaceae,Platanthera,huronensis,,,,,"Case, Fred",1983,"Curtis, John; Kurtenacher, Jane",s.n.,6/23/35,1935,6,23,United States,Wisconsin,Ozaukee,Cedarburg,Cedarburg Bog State Natural Area,,,,,,,,,,,,,,,,,,,,,,,,,,,Platanthera huronensis,No
v0002733WIS,Orchidaceae,Spiranthes,romanzoffiana,,,,,"Case, Fred",1983,"Curtis, John",38-58,6/25/38,1938,6,25,United States,Wisconsin,Ozaukee,Cedarburg,Cedarburg Bog State Natural Area,,,,,,,,,,,,,,,,,,,,,,,,,,,Spiranthes romanzoffiana,No
v0001564WIS,Orchidaceae,Platanthera,,,,,,"Case, Fred",1961,"Cutler, H.",147,7/18/34,1934,7,18,United States,Wisconsin,Ozaukee,Cedarburg bog,Cedarburg Bog State Natural Area,Cedarburg,C,43.382170 N,88.010000 W,,,,,,,,,,bog.,cream colored flowers; det. uncertain P. psycodes f. albiflera or X P. andreswii,,43.38217,-88.01,,,,,Georeferencing Quick Reference Guide 2012-10-02,Geolocate,3047,m,,
v0002272WIS,Orchidaceae,Amerorchis,rotundifolia,,,,,"Case, Fred",1983,"Curtis, John; Kurtenacher, Jane",s.n.,6/23/35,1935,6,23,United States,Wisconsin,Ozaukee,Cedarburg Bog,Cedarburg Bog State Natural Area,,,43.382170 N,88.010000 W,,,,,,,,,,bog,,,43.38217,-88.01,,,,,Georeferencing Quick Reference Guide 2012-10-02,Geolocate,3047,m,Amerorchis rotundifolia,Yes
v0002451WIS,Orchidaceae,Pogonia,ophioglossoides,,,,,"Case, Fred",1963,"Cutler, H.",220,7/22/34,1934,7,22,United States,Wisconsin,Ozaukee,Cedarburg Bog,Cedarburg Bog State Natural Area,,,43.382170 N,88.010000 W,,,,,,,,,,boggy woods,,,43.38217,-88.01,,,,,Georeferencing Quick Reference Guide 2012-10-02,Geolocate,3047,m,Pogonia ophioglossoides,Yes
v0001536WIS,Orchidaceae,Platanthera,clavellata,,,,,"Case, Fred",1983,"Jones, J.",s.n.,Jun-53,1953,6,,United States,Wisconsin,Ozaukee,"Cedarburg Bog, Stand 5000",Cedarburg Bog State Natural Area,Cedarburg,C,,,11N,21E,31,,,,,,,bog.,,,43.37464503,-88.03014454,,,,"Latitude/Longitude was derived from the Township, Range, Section location. This causes an imprecision.",,"GEODISC 2.1 WI Dept. of Natl. Res., Geographic Services Section",1138,m,Platanthera clavellata,Yes
v0057415WIS,Orchidaceae,Calopogon,tuberosus,,tuberosus,,,"Goldman, D.",7/2/99,"Cutler, H.",160,7/18/34,1934,7,18,United States,Wisconsin,Ozaukee,Cedarburg bog.,Cedarburg Bog State Natural Area,,,43.382170 N,88.010000 W,,,,,,,,,,,,,43.38217,-88.01,,,,,Georeferencing Quick Reference Guide 2012-10-02,Geolocate,3047,m,Calopogon tuberosus tuberosus,Yes
v0000610WIS,Orchidaceae,Corallorhiza,trifida,,,,,"Magrath, Lawrence",,"Sieker, William; Sieker, George",s.n.,6/8/31,1931,6,8,United States,Wisconsin,Ozaukee,Cedarburg Swamp,Cedarburg Bog State Natural Area,,,,,11N,21E,31,,11N,21E,32,,,swamp.,common,,,,,,,,,,,,Corallorhiza trifida,No
v0000749WIS,Orchidaceae,Cypripedium,acaule,,,,,"Case, Fred",1983,"Curtis, John; Kurtenacher, Jane",s.n.,6/23/35,1935,6,23,United States,Wisconsin,Ozaukee,CEDARBURG SWAMP,Cedarburg Bog State Natural Area,,,43.382170 N,88.010000 W,,,,,,,,,,swamp,,,43.38217,-88.01,,,,,Georeferencing Quick Reference Guide 2012-10-02,Geolocate,3047,m,Cypripedium acaule,Yes
v0000873WIS,Orchidaceae,Cypripedium,parviflorum,,pubescens,,,"Case, Martha",Jun-93,"Sieker, William; Sieker, George",s.n.,6/8/31,1931,6,8,United States,Wisconsin,Ozaukee,CEDARBURG SWAMP,Cedarburg Bog State Natural Area,,,43.382170 N,88.010000 W,,,,,,,,,,Marshy deep woods.,,,43.38217,-88.01,,,,,Georeferencing Quick Reference Guide 2012-10-02,Geolocate,3047,m,Cypripedium parviflorum pubescens,Yes
v0001665WIS,Orchidaceae,Platanthera,huronensis,,,,,"Case, Fred",1983,"Curtis, John; Kurtenacher, Jane",s.n.,6/23/35,1935,6,23,United States,Wisconsin,Ozaukee,CEDARBURG SWAMP,Cedarburg Bog State Natural Area,,,43.382170 N,88.010000 W,,,,,,,,,,swamp,,,43.38217,-88.01,,,,,Georeferencing Quick Reference Guide 2012-10-02,Geolocate,3047,m,Platanthera huronensis,No
v0001709WIS,Orchidaceae,Platanthera,huronensis,,,,,"Case, Fred",8/10/83,"Sieker, William; Sieker, George",s.n.,6/8/31,1931,6,8,United States,Wisconsin,Ozaukee,CEDARBURG SWAMP,Cedarburg Bog State Natural Area,,,43.382170 N,88.010000 W,,,,,,,,,,,,,43.38217,-88.01,,,,,Georeferencing Quick Reference Guide 2012-10-02,Geolocate,3047,m,Platanthera huronensis,No
v0001710WIS,Orchidaceae,Platanthera,huronensis,,,,,"Case, Fred",8/10/83,"Sieker, William; Sieker, George",s.n.,6/16/31,1931,6,16,United States,Wisconsin,Ozaukee,CEDARBURG SWAMP,Cedarburg Bog State Natural Area,,,43.382170 N,88.010000 W,,,,,,,,,,,,,43.38217,-88.01,,,,,Georeferencing Quick Reference Guide 2012-10-02,Geolocate,3047,m,Platanthera huronensis,No
v0001732WIS,Orchidaceae,Platanthera,huronensis,,,,,"Case, Fred",1961,"Fuller, A.",1675,6/10/27,1927,6,10,United States,Wisconsin,Ozaukee,CEDARBURG SWAMP,Cedarburg Bog State Natural Area,,,43.382170 N,88.010000 W,,,,,,,,,,,common,,43.38217,-88.01,,,,,Georeferencing Quick Reference Guide 2012-10-02,Geolocate,3047,m,Platanthera huronensis,No
v0001733WIS,Orchidaceae,Platanthera,huronensis,,,,,"Case, Fred",1961,"Fuller, A.",1767,7/6/27,1927,7,6,United States,Wisconsin,Ozaukee,CEDARBURG SWAMP,Cedarburg Bog State Natural Area,,,43.382170 N,88.010000 W,,,,,,,,,,,,,43.38217,-88.01,,,,,Georeferencing Quick Reference Guide 2012-10-02,Geolocate,3047,m,Platanthera huronensis,No
v0001863WIS,Orchidaceae,Platanthera,huronensis,,,,,"Case, Fred",1983,"Curtis, John; Kurtenacher, Jane",s.n.,6/23/35,1935,6,23,United States,Wisconsin,Ozaukee,CEDARBURG SWAMP,Cedarburg Bog State Natural Area,,,43.382170 N,88.010000 W,,,,,,,,,,swamp,,,43.38217,-88.01,,,,,Georeferencing Quick Reference Guide 2012-10-02,Geolocate,3047,m,Platanthera huronensis,No
v0002131WIS,Orchidaceae,Liparis,loeselii,,,,,"Case, Fred",2/6/62,"Fuller, A.",2381,7/13/28,1928,7,13,United States,Wisconsin,Ozaukee,CEDARBURG SWAMP,Cedarburg Bog State Natural Area,,,43.382170 N,88.010000 W,,,,,,,,,,Abundant under Thuja occidentalis.,,,43.38217,-88.01,,,,,Georeferencing Quick Reference Guide 2012-10-02,Geolocate,3047,m,Liparis loeselii,No
v0002150WIS,Orchidaceae,Liparis,loeselii,,,,,"Case, Fred",1983,"Sieker, William; Sieker, George",s.n.,6/16/31,1931,6,16,United States,Wisconsin,Ozaukee,CEDARBURG SWAMP,Cedarburg Bog State Natural Area,,,43.382170 N,88.010000 W,,,,,,,,,,Densely wooded bog,,,43.38217,-88.01,,,,,Georeferencing Quick Reference Guide 2012-10-02,Geolocate,3047,m,Liparis loeselii,No
v0002280WIS,Orchidaceae,Amerorchis,rotundifolia,,,,,"Case, Fred",1983,"Sieker, William; Sieker, George",s.n.,6/23/35,1935,6,23,United States,Wisconsin,Ozaukee,CEDARBURG SWAMP,Cedarburg Bog State Natural Area,,,43.382170 N,88.010000 W,,,,,,,,,,swamp,,,43.38217,-88.01,,,,,Georeferencing Quick Reference Guide 2012-10-02,Geolocate,3047,m,Amerorchis rotundifolia,Yes
v0002282WIS,Orchidaceae,Amerorchis,rotundifolia,,,,,"Case, Fred",1963,"Fuller, A.",112,6/12/25,1925,6,12,United States,Wisconsin,Ozaukee,CEDARBURG SWAMP,Cedarburg Bog State Natural Area,,,43.382170 N,88.010000 W,,,,,,,,,,swamp. In a thick clump of Thuja occidentalis,,,43.38217,-88.01,,,,,Georeferencing Quick Reference Guide 2012-10-02,Geolocate,3047,m,Amerorchis rotundifolia,Yes
v0000262WIS,Orchidaceae,Arethusa,bulbosa,,,,,"Case, Fred",1963,"Kittsley, Harold",s.n.,6/26/28,1928,6,26,United States,Wisconsin,Ozaukee,"Cedarburg Swamp, Cedarburg",Cedarburg Bog State Natural Area,,C,43.382170 N,88.010000 W,,,,,,,,,,,,,43.38217,-88.01,,,,,Georeferencing Quick Reference Guide 2012-10-02,Geolocate,3047,m,Arethusa bulbosa,Yes
v0000785WIS,Orchidaceae,Cypripedium,arietinum,,,,,"Case, Fred",1983,"Wadmond, S.",1477,6/4/26,1926,6,4,United States,Wisconsin,Ozaukee,"Cedarburg Swamp, Cedarburg",Cedarburg Bog State Natural Area,,C,43.382170 N,88.010000 W,,,,,,,,,,swamp,,,43.38217,-88.01,,,,,Georeferencing Quick Reference Guide 2012-10-02,Geolocate,3047,m,Cypripedium arietinum,Yes
v0000790WIS,Orchidaceae,Cypripedium,arietinum,,,,,"Case, Fred",1983,"Sieker, William; Sieker, George",s.n.,6/8/31,1931,6,8,United States,Wisconsin,Ozaukee,"Cedarburg Swamp, Cedarburg",Cedarburg Bog State Natural Area,,C,43.382170 N,88.010000 W,,,,,,,,,,swamp,,,43.38217,-88.01,,,,,Georeferencing Quick Reference Guide 2012-10-02,Geolocate,3047,m,Cypripedium arietinum,Yes
v0000794WIS,Orchidaceae,Cypripedium,arietinum,,,,,"Case, Fred",1983,"Sieker, William; Sieker, L.",s.n.,6/8/31,1931,6,8,United States,Wisconsin,Ozaukee,"Cedarburg Swamp, Cedarburg",Cedarburg Bog State Natural Area,,C,43.382170 N,88.010000 W,,,,,,,,,,swamp.,BER2004.,,43.38217,-88.01,,,,,Georeferencing Quick Reference Guide 2012-10-02,Geolocate,3047,m,Cypripedium arietinum,Yes
v0000966WIS,Orchidaceae,Cypripedium,parviflorum,,makasin,,,"Atwood, John",11/19/83,"Fuller, A.",1678,6/10/27,1927,6,10,United States,Wisconsin,Ozaukee,"Cedarburg Swamp, Cedarburg",Cedarburg Bog State Natural Area,,C,43.382170 N,88.010000 W,,,,,,,,,,"Swamp, abundant in marginal copse of Cornus stolonifera and Salix.",,,43.38217,-88.01,,,,,Georeferencing Quick Reference Guide 2012-10-02,Geolocate,3047,m,Cypripedium parviflorum makasin,Yes
v0001001WIS,Orchidaceae,Cypripedium,parviflorum,,makasin,,,"Atwood, John",11/19/83,"Fuller, A.",1678,6/10/27,1927,6,10,United States,Wisconsin,Ozaukee,"Cedarburg Swamp, Cedarburg",Cedarburg Bog State Natural Area,,C,43.382170 N,88.010000 W,,,,,,,,,,Swamp.,Lip of many plants blotched with Mahogany spots.,BER2004. ,43.38217,-88.01,,,,,Georeferencing Quick Reference Guide 2012-10-02,Geolocate,3047,m,Cypripedium parviflorum makasin,Yes
v0001072WIS,Orchidaceae,Cypripedium,reginae,,,,,"Case, Fred",1963,"Fuller, A.",1769,7/6/27,1927,7,6,United States,Wisconsin,Ozaukee,"Cedarburg Swamp, Cedarburg",Cedarburg Bog State Natural Area,,C,43.382170 N,88.010000 W,,,,,,,,,,swamp.,BER2004. Abundant in large clumps.,,43.38217,-88.01,,,,,Georeferencing Quick Reference Guide 2012-10-02,Geolocate,3047,m,Cypripedium reginae,Yes
v0001115WIS,Orchidaceae,Cypripedium,reginae,,,,,"Case, Fred",1983,"Sieker, William; Sieker, George",s.n.,6/16/31,1931,6,16,United States,Wisconsin,Ozaukee,"Cedarburg Swamp, Cedarburg",Cedarburg Bog State Natural Area,,C,43.382170 N,88.010000 W,,,,,,,,,,swamp,,,43.38217,-88.01,,,,,Georeferencing Quick Reference Guide 2012-10-02,Geolocate,3047,m,Cypripedium reginae,Yes
v0001545WIS,Orchidaceae,Platanthera,dilatata,,dilatata,,,"Case, Fred",1961,"Kittsley, Harold",s.n.,6/23/28,1928,6,23,United States,Wisconsin,Ozaukee,"Cedarburg Swamp, Cedarburg",Cedarburg Bog State Natural Area,,C,43.382170 N,88.010000 W,,,,,,,,,,swamp,,,43.38217,-88.01,,,,,Georeferencing Quick Reference Guide 2012-10-02,Geolocate,3047,m,Platanthera dilatata dilatata,Yes
v0001546WIS,Orchidaceae,Platanthera,dilatata,,dilatata,,,"Case, Fred",1983,"Curtis, John",53,6/26/32,1932,6,26,United States,Wisconsin,Ozaukee,"Cedarburg Swamp, Cedarburg",Cedarburg Bog State Natural Area,,C,43.382170 N,88.010000 W,,,,,,,,,,"swamp, Tamarack and Cedar",,,43.38217,-88.01,,,,,Georeferencing Quick Reference Guide 2012-10-02,Geolocate,3047,m,Platanthera dilatata dilatata,Yes
v0001554WIS,Orchidaceae,Platanthera,dilatata,,dilatata,,,"Case, Fred",1983,"Sieker, William; Sieker, George",s.n.,6/16/31,1931,6,16,United States,Wisconsin,Ozaukee,"Cedarburg Swamp, Cedarburg",Cedarburg Bog State Natural Area,,C,43.382170 N,88.010000 W,,,,,,,,,,swamp,,,43.38217,-88.01,,,,,Georeferencing Quick Reference Guide 2012-10-02,Geolocate,3047,m,Platanthera dilatata dilatata,Yes
v0001730WIS,Orchidaceae,Platanthera,huronensis,,,,,"Case, Fred",1961,"Kittsley, Harold",s.n.,6/27/28,1928,6,27,United States,Wisconsin,Ozaukee,"Cedarburg Swamp, Cedarburg",Cedarburg Bog State Natural Area,,C,43.382170 N,88.010000 W,,,,,,,,,,swamp,,,43.38217,-88.01,,,,,Georeferencing Quick Reference Guide 2012-10-02,Geolocate,3047,m,Platanthera huronensis,No
v0001073WIS,Orchidaceae,Cypripedium,reginae,,,,,"Case, Fred",1983,"Waite, George; Curtis, John",1048,6/25/32,1932,6,25,United States,Wisconsin,Ozaukee,"Cedarburg swamp,5mi NW of Cedarburg",Cedarburg Bog State Natural Area,Cedarburg,C,43.382170 N,88.010000 W,,,,,,,,,,swamp,,,43.38217,-88.01,,,,,Georeferencing Quick Reference Guide 2012-10-02,Geolocate,3047,m,Cypripedium reginae,Yes
v0001013WIS,Orchidaceae,Cypripedium,candidum,,,,,"Case, Fred",1963,"Johnson, Albert",s.n.,5/25/48,1948,5,25,United States,Wisconsin,Waukesha,"Chapman Farm, 1mi S of Waukesha on Soo Line tracks",,Waukesha,C,,,06N,19E,15,NE4SW4,,,,,,boggy meadow; Associated with Hypoxis and Dodecatheaon,,,,,,,,,,,,,Cypripedium candidum,Yes
v0020277WIS,Orchidaceae,Spiranthes,cernua,,,,,"Hapeman, Jeffery",1/24/96,"Hujik, Peter",204a,9/11/93,1993,9,11,United States,Wisconsin,Kenosha,Chiwaukee Prairie,Chiwaukee Prairie State Natural Area,,,,,01N,23E,31,,,,,,,,Nodding Ladies' Tresses [mixed collection with v0020278WIS],,42.50015862,-87.82359307,,,,"Latitude/Longitude was derived from the Township, Range, Section location. This causes an imprecision.",,"GEODISC 2.1 WI Dept. of Natl. Res., Geographic Services Section",1138,m,Spiranthes cernua,No
v0020277WIS,Orchidaceae,Spiranthes,cernua,,,,,"Hapeman, Jeffery",1/24/96,"Hujik, Peter",204a,9/11/93,1993,9,11,United States,Wisconsin,Kenosha,Chiwaukee Prairie,Chiwaukee Prairie State Natural Area,,,,,01N,23E,31,,,,,,,,Nodding Ladies' Tresses [mixed collection with v0020278WIS],,42.50015862,-87.82359307,,,,"Latitude/Longitude was derived from the Township, Range, Section location. This causes an imprecision.",,"GEODISC 2.1 WI Dept. of Natl. Res., Geographic Services Section",1138,m,Spiranthes cernua,No
v0020277WIS,Orchidaceae,Spiranthes,cernua,,,,,"Hapeman, Jeffery",1/24/96,"Hujik, Peter",204a,9/11/93,1993,9,11,United States,Wisconsin,Kenosha,Chiwaukee Prairie,Chiwaukee Prairie State Natural Area,,,,,01N,23E,31,,,,,,,,Nodding Ladies' Tresses [mixed collection with v0020278WIS],,42.50015862,-87.82359307,,,,"Latitude/Longitude was derived from the Township, Range, Section location. This causes an imprecision.",,"GEODISC 2.1 WI Dept. of Natl. Res., Geographic Services Section",1138,m,Spiranthes cernua,No
v0020277WIS,Orchidaceae,Spiranthes,cernua,,,,,"Hapeman, Jeffery",1/24/96,"Hujik, Peter",204a,9/11/93,1993,9,11,United States,Wisconsin,Kenosha,Chiwaukee Prairie,Chiwaukee Prairie State Natural Area,,,,,01N,23E,31,,,,,,,,Nodding Ladies' Tresses [mixed collection with v0020278WIS],,42.50015862,-87.82359307,,,,"Latitude/Longitude was derived from the Township, Range, Section location. This causes an imprecision.",,"GEODISC 2.1 WI Dept. of Natl. Res., Geographic Services Section",1138,m,Spiranthes cernua,No
v0020277WIS,Orchidaceae,Spiranthes,cernua,,,,,"Hapeman, Jeffery",1/24/96,"Hujik, Peter",204a,9/11/93,1993,9,11,United States,Wisconsin,Kenosha,Chiwaukee Prairie,Chiwaukee Prairie State Natural Area,,,,,01N,23E,31,,,,,,,,Nodding Ladies' Tresses [mixed collection with v0020278WIS],,42.50015862,-87.82359307,,,,"Latitude/Longitude was derived from the Township, Range, Section location. This causes an imprecision.",,"GEODISC 2.1 WI Dept. of Natl. Res., Geographic Services Section",1138,m,Spiranthes cernua,No
v0020277WIS,Orchidaceae,Spiranthes,cernua,,,,,"Hapeman, Jeffery",1/24/96,"Hujik, Peter",204a,9/11/93,1993,9,11,United States,Wisconsin,Kenosha,Chiwaukee Prairie,Chiwaukee Prairie State Natural Area,,,,,01N,23E,31,,,,,,,,Nodding Ladies' Tresses [mixed collection with v0020278WIS],,42.50015862,-87.82359307,,,,"Latitude/Longitude was derived from the Township, Range, Section location. This causes an imprecision.",,"GEODISC 2.1 WI Dept. of Natl. Res., Geographic Services Section",1138,m,Spiranthes cernua,No
v0020277WIS,Orchidaceae,Spiranthes,cernua,,,,,"Hapeman, Jeffery",1/24/96,"Hujik, Peter",204a,9/11/93,1993,9,11,United States,Wisconsin,Kenosha,Chiwaukee Prairie,Chiwaukee Prairie State Natural Area,,,,,01N,23E,31,,,,,,,,Nodding Ladies' Tresses [mixed collection with v0020278WIS],,42.50015862,-87.82359307,,,,"Latitude/Longitude was derived from the Township, Range, Section location. This causes an imprecision.",,"GEODISC 2.1 WI Dept. of Natl. Res., Geographic Services Section",1138,m,Spiranthes cernua,No
v0020277WIS,Orchidaceae,Spiranthes,cernua,,,,,"Hapeman, Jeffery",1/24/96,"Hujik, Peter",204a,9/11/93,1993,9,11,United States,Wisconsin,Kenosha,Chiwaukee Prairie,Chiwaukee Prairie State Natural Area,,,,,01N,23E,31,,,,,,,,Nodding Ladies' Tresses [mixed collection with v0020278WIS],,42.50015862,-87.82359307,,,,"Latitude/Longitude was derived from the Township, Range, Section location. This causes an imprecision.",,"GEODISC 2.1 WI Dept. of Natl. Res., Geographic Services Section",1138,m,Spiranthes cernua,No
v0020277WIS,Orchidaceae,Spiranthes,cernua,,,,,"Hapeman, Jeffery",1/24/96,"Hujik, Peter",204a,9/11/93,1993,9,11,United States,Wisconsin,Kenosha,Chiwaukee Prairie,Chiwaukee Prairie State Natural Area,,,,,01N,23E,31,,,,,,,,Nodding Ladies' Tresses [mixed collection with v0020278WIS],,42.50015862,-87.82359307,,,,"Latitude/Longitude was derived from the Township, Range, Section location. This causes an imprecision.",,"GEODISC 2.1 WI Dept. of Natl. Res., Geographic Services Section",1138,m,Spiranthes cernua,No
v0020277WIS,Orchidaceae,Spiranthes,cernua,,,,,"Hapeman, Jeffery",1/24/96,"Hujik, Peter",204a,9/11/93,1993,9,11,United States,Wisconsin,Kenosha,Chiwaukee Prairie,Chiwaukee Prairie State Natural Area,,,,,01N,23E,31,,,,,,,,Nodding Ladies' Tresses [mixed collection with v0020278WIS],,42.50015862,-87.82359307,,,,"Latitude/Longitude was derived from the Township, Range, Section location. This causes an imprecision.",,"GEODISC 2.1 WI Dept. of Natl. Res., Geographic Services Section",1138,m,Spiranthes cernua,No
v0020277WIS,Orchidaceae,Spiranthes,cernua,,,,,"Hapeman, Jeffery",1/24/96,"Hujik, Peter",204a,9/11/93,1993,9,11,United States,Wisconsin,Kenosha,Chiwaukee Prairie,Chiwaukee Prairie State Natural Area,,,,,01N,23E,31,,,,,,,,Nodding Ladies' Tresses [mixed collection with v0020278WIS],,42.50015862,-87.82359307,,,,"Latitude/Longitude was derived from the Township, Range, Section location. This causes an imprecision.",,"GEODISC 2.1 WI Dept. of Natl. Res., Geographic Services Section",1138,m,Spiranthes cernua,No
v0020277WIS,Orchidaceae,Spiranthes,cernua,,,,,"Hapeman, Jeffery",1/24/96,"Hujik, Peter",204a,9/11/93,1993,9,11,United States,Wisconsin,Kenosha,Chiwaukee Prairie,Chiwaukee Prairie State Natural Area,,,,,01N,23E,31,,,,,,,,Nodding Ladies' Tresses [mixed collection with v0020278WIS],,42.50015862,-87.82359307,,,,"Latitude/Longitude was derived from the Township, Range, Section location. This causes an imprecision.",,"GEODISC 2.1 WI Dept. of Natl. Res., Geographic Services Section",1138,m,Spiranthes cernua,No
v0020277WIS,Orchidaceae,Spiranthes,cernua,,,,,"Hapeman, Jeffery",1/24/96,"Hujik, Peter",204a,9/11/93,1993,9,11,United States,Wisconsin,Kenosha,Chiwaukee Prairie,Chiwaukee Prairie State Natural Area,,,,,01N,23E,31,,,,,,,,Nodding Ladies' Tresses [mixed collection with v0020278WIS],,42.50015862,-87.82359307,,,,"Latitude/Longitude was derived from the Township, Range, Section location. This causes an imprecision.",,"GEODISC 2.1 WI Dept. of Natl. Res., Geographic Services Section",1138,m,Spiranthes cernua,No
v0020277WIS,Orchidaceae,Spiranthes,cernua,,,,,"Hapeman, Jeffery",1/24/96,"Hujik, Peter",204a,9/11/93,1993,9,11,United States,Wisconsin,Kenosha,Chiwaukee Prairie,Chiwaukee Prairie State Natural Area,,,,,01N,23E,31,,,,,,,,Nodding Ladies' Tresses [mixed collection with v0020278WIS],,42.50015862,-87.82359307,,,,"Latitude/Longitude was derived from the Township, Range, Section location. This causes an imprecision.",,"GEODISC 2.1 WI Dept. of Natl. Res., Geographic Services Section",1138,m,Spiranthes cernua,No
v0020277WIS,Orchidaceae,Spiranthes,cernua,,,,,"Hapeman, Jeffery",1/24/96,"Hujik, Peter",204a,9/11/93,1993,9,11,United States,Wisconsin,Kenosha,Chiwaukee Prairie,Chiwaukee Prairie State Natural Area,,,,,01N,23E,31,,,,,,,,Nodding Ladies' Tresses [mixed collection with v0020278WIS],,42.50015862,-87.82359307,,,,"Latitude/Longitude was derived from the Township, Range, Section location. This causes an imprecision.",,"GEODISC 2.1 WI Dept. of Natl. Res., Geographic Services Section",1138,m,Spiranthes cernua,No
v0020277WIS,Orchidaceae,Spiranthes,cernua,,,,,"Hapeman, Jeffery",1/24/96,"Hujik, Peter",204a,9/11/93,1993,9,11,United States,Wisconsin,Kenosha,Chiwaukee Prairie,Chiwaukee Prairie State Natural Area,,,,,01N,23E,31,,,,,,,,Nodding Ladies' Tresses [mixed collection with v0020278WIS],,42.50015862,-87.82359307,,,,"Latitude/Longitude was derived from the Township, Range, Section location. This causes an imprecision.",,"GEODISC 2.1 WI Dept. of Natl. Res., Geographic Services Section",1138,m,Spiranthes cernua,No
v0020277WIS,Orchidaceae,Spiranthes,cernua,,,,,"Hapeman, Jeffery",1/24/96,"Hujik, Peter",204a,9/11/93,1993,9,11,United States,Wisconsin,Kenosha,Chiwaukee Prairie,Chiwaukee Prairie State Natural Area,,,,,01N,23E,31,,,,,,,,Nodding Ladies' Tresses [mixed collection with v0020278WIS],,42.50015862,-87.82359307,,,,"Latitude/Longitude was derived from the Township, Range, Section location. This causes an imprecision.",,"GEODISC 2.1 WI Dept. of Natl. Res., Geographic Services Section",1138,m,Spiranthes cernua,No
v0020277WIS,Orchidaceae,Spiranthes,cernua,,,,,"Hapeman, Jeffery",1/24/96,"Hujik, Peter",204a,9/11/93,1993,9,11,United States,Wisconsin,Kenosha,Chiwaukee Prairie,Chiwaukee Prairie State Natural Area,,,,,01N,23E,31,,,,,,,,Nodding Ladies' Tresses [mixed collection with v0020278WIS],,42.50015862,-87.82359307,,,,"Latitude/Longitude was derived from the Township, Range, Section location. This causes an imprecision.",,"GEODISC 2.1 WI Dept. of Natl. Res., Geographic Services Section",1138,m,Spiranthes cernua,No
v0020277WIS,Orchidaceae,Spiranthes,cernua,,,,,"Hapeman, Jeffery",1/24/96,"Hujik, Peter",204a,9/11/93,1993,9,11,United States,Wisconsin,Kenosha,Chiwaukee Prairie,Chiwaukee Prairie State Natural Area,,,,,01N,23E,31,,,,,,,,Nodding Ladies' Tresses [mixed collection with v0020278WIS],,42.50015862,-87.82359307,,,,"Latitude/Longitude was derived from the Township, Range, Section location. This causes an imprecision.",,"GEODISC 2.1 WI Dept. of Natl. Res., Geographic Services Section",1138,m,Spiranthes cernua,No
v0020277WIS,Orchidaceae,Spiranthes,cernua,,,,,"Hapeman, Jeffery",1/24/96,"Hujik, Peter",204a,9/11/93,1993,9,11,United States,Wisconsin,Kenosha,Chiwaukee Prairie,Chiwaukee Prairie State Natural Area,,,,,01N,23E,31,,,,,,,,Nodding Ladies' Tresses [mixed collection with v0020278WIS],,42.50015862,-87.82359307,,,,"Latitude/Longitude was derived from the Township, Range, Section location. This causes an imprecision.",,"GEODISC 2.1 WI Dept. of Natl. Res., Geographic Services Section",1138,m,Spiranthes cernua,No
v0020277WIS,Orchidaceae,Spiranthes,cernua,,,,,"Hapeman, Jeffery",1/24/96,"Hujik, Peter",204a,9/11/93,1993,9,11,United States,Wisconsin,Kenosha,Chiwaukee Prairie,Chiwaukee Prairie State Natural Area,,,,,01N,23E,31,,,,,,,,Nodding Ladies' Tresses [mixed collection with v0020278WIS],,42.50015862,-87.82359307,,,,"Latitude/Longitude was derived from the Township, Range, Section location. This causes an imprecision.",,"GEODISC 2.1 WI Dept. of Natl. Res., Geographic Services Section",1138,m,Spiranthes cernua,No
v0020277WIS,Orchidaceae,Spiranthes,cernua,,,,,"Hapeman, Jeffery",1/24/96,"Hujik, Peter",204a,9/11/93,1993,9,11,United States,Wisconsin,Kenosha,Chiwaukee Prairie,Chiwaukee Prairie State Natural Area,,,,,01N,23E,31,,,,,,,,Nodding Ladies' Tresses [mixed collection with v0020278WIS],,42.50015862,-87.82359307,,,,"Latitude/Longitude was derived from the Township, Range, Section location. This causes an imprecision.",,"GEODISC 2.1 WI Dept. of Natl. Res., Geographic Services Section",1138,m,Spiranthes cernua,No
v0020277WIS,Orchidaceae,Spiranthes,cernua,,,,,"Hapeman, Jeffery",1/24/96,"Hujik, Peter",204a,9/11/93,1993,9,11,United States,Wisconsin,Kenosha,Chiwaukee Prairie,Chiwaukee Prairie State Natural Area,,,,,01N,23E,31,,,,,,,,Nodding Ladies' Tresses [mixed collection with v0020278WIS],,42.50015862,-87.82359307,,,,"Latitude/Longitude was derived from the Township, Range, Section location. This causes an imprecision.",,"GEODISC 2.1 WI Dept. of Natl. Res., Geographic Services Section",1138,m,Spiranthes cernua,No
v0020277WIS,Orchidaceae,Spiranthes,cernua,,,,,"Hapeman, Jeffery",1/24/96,"Hujik, Peter",204a,9/11/93,1993,9,11,United States,Wisconsin,Kenosha,Chiwaukee Prairie,Chiwaukee Prairie State Natural Area,,,,,01N,23E,31,,,,,,,,Nodding Ladies' Tresses [mixed collection with v0020278WIS],,42.50015862,-87.82359307,,,,"Latitude/Longitude was derived from the Township, Range, Section location. This causes an imprecision.",,"GEODISC 2.1 WI Dept. of Natl. Res., Geographic Services Section",1138,m,Spiranthes cernua,No
v0020277WIS,Orchidaceae,Spiranthes,cernua,,,,,"Hapeman, Jeffery",1/24/96,"Hujik, Peter",204a,9/11/93,1993,9,11,United States,Wisconsin,Kenosha,Chiwaukee Prairie,Chiwaukee Prairie State Natural Area,,,,,01N,23E,31,,,,,,,,Nodding Ladies' Tresses [mixed collection with v0020278WIS],,42.50015862,-87.82359307,,,,"Latitude/Longitude was derived from the Township, Range, Section location. This causes an imprecision.",,"GEODISC 2.1 WI Dept. of Natl. Res., Geographic Services Section",1138,m,Spiranthes cernua,No
v0020277WIS,Orchidaceae,Spiranthes,cernua,,,,,"Hapeman, Jeffery",1/24/96,"Hujik, Peter",204a,9/11/93,1993,9,11,United States,Wisconsin,Kenosha,Chiwaukee Prairie,Chiwaukee Prairie State Natural Area,,,,,01N,23E,31,,,,,,,,Nodding Ladies' Tresses [mixed collection with v0020278WIS],,42.50015862,-87.82359307,,,,"Latitude/Longitude was derived from the Township, Range, Section location. This causes an imprecision.",,"GEODISC 2.1 WI Dept. of Natl. Res., Geographic Services Section",1138,m,Spiranthes cernua,No
v0020277WIS,Orchidaceae,Spiranthes,cernua,,,,,"Hapeman, Jeffery",1/24/96,"Hujik, Peter",204a,9/11/93,1993,9,11,United States,Wisconsin,Kenosha,Chiwaukee Prairie,Chiwaukee Prairie State Natural Area,,,,,01N,23E,31,,,,,,,,Nodding Ladies' Tresses [mixed collection with v0020278WIS],,42.50015862,-87.82359307,,,,"Latitude/Longitude was derived from the Township, Range, Section location. This causes an imprecision.",,"GEODISC 2.1 WI Dept. of Natl. Res., Geographic Services Section",1138,m,Spiranthes cernua,No
v0020277WIS,Orchidaceae,Spiranthes,cernua,,,,,"Hapeman, Jeffery",1/24/96,"Hujik, Peter",204a,9/11/93,1993,9,11,United States,Wisconsin,Kenosha,Chiwaukee Prairie,Chiwaukee Prairie State Natural Area,,,,,01N,23E,31,,,,,,,,Nodding Ladies' Tresses [mixed collection with v0020278WIS],,42.50015862,-87.82359307,,,,"Latitude/Longitude was derived from the Township, Range, Section location. This causes an imprecision.",,"GEODISC 2.1 WI Dept. of Natl. Res., Geographic Services Section",1138,m,Spiranthes cernua,No
v0020277WIS,Orchidaceae,Spiranthes,cernua,,,,,"Hapeman, Jeffery",1/24/96,"Hujik, Peter",204a,9/11/93,1993,9,11,United States,Wisconsin,Kenosha,Chiwaukee Prairie,Chiwaukee Prairie State Natural Area,,,,,01N,23E,31,,,,,,,,Nodding Ladies' Tresses [mixed collection with v0020278WIS],,42.50015862,-87.82359307,,,,"Latitude/Longitude was derived from the Township, Range, Section location. This causes an imprecision.",,"GEODISC 2.1 WI Dept. of Natl. Res., Geographic Services Section",1138,m,Spiranthes cernua,No
v0020277WIS,Orchidaceae,Spiranthes,cernua,,,,,"Hapeman, Jeffery",1/24/96,"Hujik, Peter",204a,9/11/93,1993,9,11,United States,Wisconsin,Kenosha,Chiwaukee Prairie,Chiwaukee Prairie State Natural Area,,,,,01N,23E,31,,,,,,,,Nodding Ladies' Tresses [mixed collection with v0020278WIS],,42.50015862,-87.82359307,,,,"Latitude/Longitude was derived from the Township, Range, Section location. This causes an imprecision.",,"GEODISC 2.1 WI Dept. of Natl. Res., Geographic Services Section",1138,m,Spiranthes cernua,No
v0020277WIS,Orchidaceae,Spiranthes,cernua,,,,,"Hapeman, Jeffery",1/24/96,"Hujik, Peter",204a,9/11/93,1993,9,11,United States,Wisconsin,Kenosha,Chiwaukee Prairie,Chiwaukee Prairie State Natural Area,,,,,01N,23E,31,,,,,,,,Nodding Ladies' Tresses [mixed collection with v0020278WIS],,42.50015862,-87.82359307,,,,"Latitude/Longitude was derived from the Township, Range, Section location. This causes an imprecision.",,"GEODISC 2.1 WI Dept. of Natl. Res., Geographic Services Section",1138,m,Spiranthes cernua,No
v0020277WIS,Orchidaceae,Spiranthes,cernua,,,,,"Hapeman, Jeffery",1/24/96,"Hujik, Peter",204a,9/11/93,1993,9,11,United States,Wisconsin,Kenosha,Chiwaukee Prairie,Chiwaukee Prairie State Natural Area,,,,,01N,23E,31,,,,,,,,Nodding Ladies' Tresses [mixed collection with v0020278WIS],,42.50015862,-87.82359307,,,,"Latitude/Longitude was derived from the Township, Range, Section location. This causes an imprecision.",,"GEODISC 2.1 WI Dept. of Natl. Res., Geographic Services Section",1138,m,Spiranthes cernua,No
v0020277WIS,Orchidaceae,Spiranthes,cernua,,,,,"Hapeman, Jeffery",1/24/96,"Hujik, Peter",204a,9/11/93,1993,9,11,United States,Wisconsin,Kenosha,Chiwaukee Prairie,Chiwaukee Prairie State Natural Area,,,,,01N,23E,31,,,,,,,,Nodding Ladies' Tresses [mixed collection with v0020278WIS],,42.50015862,-87.82359307,,,,"Latitude/Longitude was derived from the Township, Range, Section location. This causes an imprecision.",,"GEODISC 2.1 WI Dept. of Natl. Res., Geographic Services Section",1138,m,Spiranthes cernua,No
v0020277WIS,Orchidaceae,Spiranthes,cernua,,,,,"Hapeman, Jeffery",1/24/96,"Hujik, Peter",204a,9/11/93,1993,9,11,United States,Wisconsin,Kenosha,Chiwaukee Prairie,Chiwaukee Prairie State Natural Area,,,,,01N,23E,31,,,,,,,,Nodding Ladies' Tresses [mixed collection with v0020278WIS],,42.50015862,-87.82359307,,,,"Latitude/Longitude was derived from the Township, Range, Section location. This causes an imprecision.",,"GEODISC 2.1 WI Dept. of Natl. Res., Geographic Services Section",1138,m,Spiranthes cernua,No
v0020277WIS,Orchidaceae,Spiranthes,cernua,,,,,"Hapeman, Jeffery",1/24/96,"Hujik, Peter",204a,9/11/93,1993,9,11,United States,Wisconsin,Kenosha,Chiwaukee Prairie,Chiwaukee Prairie State Natural Area,,,,,01N,23E,31,,,,,,,,Nodding Ladies' Tresses [mixed collection with v0020278WIS],,42.50015862,-87.82359307,,,,"Latitude/Longitude was derived from the Township, Range, Section location. This causes an imprecision.",,"GEODISC 2.1 WI Dept. of Natl. Res., Geographic Services Section",1138,m,Spiranthes cernua,No
v0020277WIS,Orchidaceae,Spiranthes,cernua,,,,,"Hapeman, Jeffery",1/24/96,"Hujik, Peter",204a,9/11/93,1993,9,11,United States,Wisconsin,Kenosha,Chiwaukee Prairie,Chiwaukee Prairie State Natural Area,,,,,01N,23E,31,,,,,,,,Nodding Ladies' Tresses [mixed collection with v0020278WIS],,42.50015862,-87.82359307,,,,"Latitude/Longitude was derived from the Township, Range, Section location. This causes an imprecision.",,"GEODISC 2.1 WI Dept. of Natl. Res., Geographic Services Section",1138,m,Spiranthes cernua,No
v0020277WIS,Orchidaceae,Spiranthes,cernua,,,,,"Hapeman, Jeffery",1/24/96,"Hujik, Peter",204a,9/11/93,1993,9,11,United States,Wisconsin,Kenosha,Chiwaukee Prairie,Chiwaukee Prairie State Natural Area,,,,,01N,23E,31,,,,,,,,Nodding Ladies' Tresses [mixed collection with v0020278WIS],,42.50015862,-87.82359307,,,,"Latitude/Longitude was derived from the Township, Range, Section location. This causes an imprecision.",,"GEODISC 2.1 WI Dept. of Natl. Res., Geographic Services Section",1138,m,Spiranthes cernua,No
v0020277WIS,Orchidaceae,Spiranthes,cernua,,,,,"Hapeman, Jeffery",1/24/96,"Hujik, Peter",204a,9/11/93,1993,9,11,United States,Wisconsin,Kenosha,Chiwaukee Prairie,Chiwaukee Prairie State Natural Area,,,,,01N,23E,31,,,,,,,,Nodding Ladies' Tresses [mixed collection with v0020278WIS],,42.50015862,-87.82359307,,,,"Latitude/Longitude was derived from the Township, Range, Section location. This causes an imprecision.",,"GEODISC 2.1 WI Dept. of Natl. Res., Geographic Services Section",1138,m,Spiranthes cernua,No
v0020277WIS,Orchidaceae,Spiranthes,cernua,,,,,"Hapeman, Jeffery",1/24/96,"Hujik, Peter",204a,9/11/93,1993,9,11,United States,Wisconsin,Kenosha,Chiwaukee Prairie,Chiwaukee Prairie State Natural Area,,,,,01N,23E,31,,,,,,,,Nodding Ladies' Tresses [mixed collection with v0020278WIS],,42.50015862,-87.82359307,,,,"Latitude/Longitude was derived from the Township, Range, Section location. This causes an imprecision.",,"GEODISC 2.1 WI Dept. of Natl. Res., Geographic Services Section",1138,m,Spiranthes cernua,No
v0020277WIS,Orchidaceae,Spiranthes,cernua,,,,,"Hapeman, Jeffery",1/24/96,"Hujik, Peter",204a,9/11/93,1993,9,11,United States,Wisconsin,Kenosha,Chiwaukee Prairie,Chiwaukee Prairie State Natural Area,,,,,01N,23E,31,,,,,,,,Nodding Ladies' Tresses [mixed collection with v0020278WIS],,42.50015862,-87.82359307,,,,"Latitude/Longitude was derived from the Township, Range, Section location. This causes an imprecision.",,"GEODISC 2.1 WI Dept. of Natl. Res., Geographic Services Section",1138,m,Spiranthes cernua,No
v0020277WIS,Orchidaceae,Spiranthes,cernua,,,,,"Hapeman, Jeffery",1/24/96,"Hujik, Peter",204a,9/11/93,1993,9,11,United States,Wisconsin,Kenosha,Chiwaukee Prairie,Chiwaukee Prairie State Natural Area,,,,,01N,23E,31,,,,,,,,Nodding Ladies' Tresses [mixed collection with v0020278WIS],,42.50015862,-87.82359307,,,,"Latitude/Longitude was derived from the Township, Range, Section location. This causes an imprecision.",,"GEODISC 2.1 WI Dept. of Natl. Res., Geographic Services Section",1138,m,Spiranthes cernua,No
v0020277WIS,Orchidaceae,Spiranthes,cernua,,,,,"Hapeman, Jeffery",1/24/96,"Hujik, Peter",204a,9/11/93,1993,9,11,United States,Wisconsin,Kenosha,Chiwaukee Prairie,Chiwaukee Prairie State Natural Area,,,,,01N,23E,31,,,,,,,,Nodding Ladies' Tresses [mixed collection with v0020278WIS],,42.50015862,-87.82359307,,,,"Latitude/Longitude was derived from the Township, Range, Section location. This causes an imprecision.",,"GEODISC 2.1 WI Dept. of Natl. Res., Geographic Services Section",1138,m,Spiranthes cernua,No
v0020277WIS,Orchidaceae,Spiranthes,cernua,,,,,"Hapeman, Jeffery",1/24/96,"Hujik, Peter",204a,9/11/93,1993,9,11,United States,Wisconsin,Kenosha,Chiwaukee Prairie,Chiwaukee Prairie State Natural Area,,,,,01N,23E,31,,,,,,,,Nodding Ladies' Tresses [mixed collection with v0020278WIS],,42.50015862,-87.82359307,,,,"Latitude/Longitude was derived from the Township, Range, Section location. This causes an imprecision.",,"GEODISC 2.1 WI Dept. of Natl. Res., Geographic Services Section",1138,m,Spiranthes cernua,No
v0020277WIS,Orchidaceae,Spiranthes,cernua,,,,,"Hapeman, Jeffery",1/24/96,"Hujik, Peter",204a,9/11/93,1993,9,11,United States,Wisconsin,Kenosha,Chiwaukee Prairie,Chiwaukee Prairie State Natural Area,,,,,01N,23E,31,,,,,,,,Nodding Ladies' Tresses [mixed collection with v0020278WIS],,42.50015862,-87.82359307,,,,"Latitude/Longitude was derived from the Township, Range, Section location. This causes an imprecision.",,"GEODISC 2.1 WI Dept. of Natl. Res., Geographic Services Section",1138,m,Spiranthes cernua,No
v0020277WIS,Orchidaceae,Spiranthes,cernua,,,,,"Hapeman, Jeffery",1/24/96,"Hujik, Peter",204a,9/11/93,1993,9,11,United States,Wisconsin,Kenosha,Chiwaukee Prairie,Chiwaukee Prairie State Natural Area,,,,,01N,23E,31,,,,,,,,Nodding Ladies' Tresses [mixed collection with v0020278WIS],,42.50015862,-87.82359307,,,,"Latitude/Longitude was derived from the Township, Range, Section location. This causes an imprecision.",,"GEODISC 2.1 WI Dept. of Natl. Res., Geographic Services Section",1138,m,Spiranthes cernua,No
v0020277WIS,Orchidaceae,Spiranthes,cernua,,,,,"Hapeman, Jeffery",1/24/96,"Hujik, Peter",204a,9/11/93,1993,9,11,United States,Wisconsin,Kenosha,Chiwaukee Prairie,Chiwaukee Prairie State Natural Area,,,,,01N,23E,31,,,,,,,,Nodding Ladies' Tresses [mixed collection with v0020278WIS],,42.50015862,-87.82359307,,,,"Latitude/Longitude was derived from the Township, Range, Section location. This causes an imprecision.",,"GEODISC 2.1 WI Dept. of Natl. Res., Geographic Services Section",1138,m,Spiranthes cernua,No
v0020277WIS,Orchidaceae,Spiranthes,cernua,,,,,"Hapeman, Jeffery",1/24/96,"Hujik, Peter",204a,9/11/93,1993,9,11,United States,Wisconsin,Kenosha,Chiwaukee Prairie,Chiwaukee Prairie State Natural Area,,,,,01N,23E,31,,,,,,,,Nodding Ladies' Tresses [mixed collection with v0020278WIS],,42.50015862,-87.82359307,,,,"Latitude/Longitude was derived from the Township, Range, Section location. This causes an imprecision.",,"GEODISC 2.1 WI Dept. of Natl. Res., Geographic Services Section",1138,m,Spiranthes cernua,No
v0020277WIS,Orchidaceae,Spiranthes,cernua,,,,,"Hapeman, Jeffery",1/24/96,"Hujik, Peter",204a,9/11/93,1993,9,11,United States,Wisconsin,Kenosha,Chiwaukee Prairie,Chiwaukee Prairie State Natural Area,,,,,01N,23E,31,,,,,,,,Nodding Ladies' Tresses [mixed collection with v0020278WIS],,42.50015862,-87.82359307,,,,"Latitude/Longitude was derived from the Township, Range, Section location. This causes an imprecision.",,"GEODISC 2.1 WI Dept. of Natl. Res., Geographic Services Section",1138,m,Spiranthes cernua,No
v0020277WIS,Orchidaceae,Spiranthes,cernua,,,,,"Hapeman, Jeffery",1/24/96,"Hujik, Peter",204a,9/11/93,1993,9,11,United States,Wisconsin,Kenosha,Chiwaukee Prairie,Chiwaukee Prairie State Natural Area,,,,,01N,23E,31,,,,,,,,Nodding Ladies' Tresses [mixed collection with v0020278WIS],,42.50015862,-87.82359307,,,,"Latitude/Longitude was derived from the Township, Range, Section location. This causes an imprecision.",,"GEODISC 2.1 WI Dept. of Natl. Res., Geographic Services Section",1138,m,Spiranthes cernua,No
v0020277WIS,Orchidaceae,Spiranthes,cernua,,,,,"Hapeman, Jeffery",1/24/96,"Hujik, Peter",204a,9/11/93,1993,9,11,United States,Wisconsin,Kenosha,Chiwaukee Prairie,Chiwaukee Prairie State Natural Area,,,,,01N,23E,31,,,,,,,,Nodding Ladies' Tresses [mixed collection with v0020278WIS],,42.50015862,-87.82359307,,,,"Latitude/Longitude was derived from the Township, Range, Section location. This causes an imprecision.",,"GEODISC 2.1 WI Dept. of Natl. Res., Geographic Services Section",1138,m,Spiranthes cernua,No
v0020277WIS,Orchidaceae,Spiranthes,cernua,,,,,"Hapeman, Jeffery",1/24/96,"Hujik, Peter",204a,9/11/93,1993,9,11,United States,Wisconsin,Kenosha,Chiwaukee Prairie,Chiwaukee Prairie State Natural Area,,,,,01N,23E,31,,,,,,,,Nodding Ladies' Tresses [mixed collection with v0020278WIS],,42.50015862,-87.82359307,,,,"Latitude/Longitude was derived from the Township, Range, Section location. This causes an imprecision.",,"GEODISC 2.1 WI Dept. of Natl. Res., Geographic Services Section",1138,m,Spiranthes cernua,No
v0020277WIS,Orchidaceae,Spiranthes,cernua,,,,,"Hapeman, Jeffery",1/24/96,"Hujik, Peter",204a,9/11/93,1993,9,11,United States,Wisconsin,Kenosha,Chiwaukee Prairie,Chiwaukee Prairie State Natural Area,,,,,01N,23E,31,,,,,,,,Nodding Ladies' Tresses [mixed collection with v0020278WIS],,42.50015862,-87.82359307,,,,"Latitude/Longitude was derived from the Township, Range, Section location. This causes an imprecision.",,"GEODISC 2.1 WI Dept. of Natl. Res., Geographic Services Section",1138,m,Spiranthes cernua,No
v0020277WIS,Orchidaceae,Spiranthes,cernua,,,,,"Hapeman, Jeffery",1/24/96,"Hujik, Peter",204a,9/11/93,1993,9,11,United States,Wisconsin,Kenosha,Chiwaukee Prairie,Chiwaukee Prairie State Natural Area,,,,,01N,23E,31,,,,,,,,Nodding Ladies' Tresses [mixed collection with v0020278WIS],,42.50015862,-87.82359307,,,,"Latitude/Longitude was derived from the Township, Range, Section location. This causes an imprecision.",,"GEODISC 2.1 WI Dept. of Natl. Res., Geographic Services Section",1138,m,Spiranthes cernua,No
v0020277WIS,Orchidaceae,Spiranthes,cernua,,,,,"Hapeman, Jeffery",1/24/96,"Hujik, Peter",204a,9/11/93,1993,9,11,United States,Wisconsin,Kenosha,Chiwaukee Prairie,Chiwaukee Prairie State Natural Area,,,,,01N,23E,31,,,,,,,,Nodding Ladies' Tresses [mixed collection with v0020278WIS],,42.50015862,-87.82359307,,,,"Latitude/Longitude was derived from the Township, Range, Section location. This causes an imprecision.",,"GEODISC 2.1 WI Dept. of Natl. Res., Geographic Services Section",1138,m,Spiranthes cernua,No
v0020277WIS,Orchidaceae,Spiranthes,cernua,,,,,"Hapeman, Jeffery",1/24/96,"Hujik, Peter",204a,9/11/93,1993,9,11,United States,Wisconsin,Kenosha,Chiwaukee Prairie,Chiwaukee Prairie State Natural Area,,,,,01N,23E,31,,,,,,,,Nodding Ladies' Tresses [mixed collection with v0020278WIS],,42.50015862,-87.82359307,,,,"Latitude/Longitude was derived from the Township, Range, Section location. This causes an imprecision.",,"GEODISC 2.1 WI Dept. of Natl. Res., Geographic Services Section",1138,m,Spiranthes cernua,No
v0020277WIS,Orchidaceae,Spiranthes,cernua,,,,,"Hapeman, Jeffery",1/24/96,"Hujik, Peter",204a,9/11/93,1993,9,11,United States,Wisconsin,Kenosha,Chiwaukee Prairie,Chiwaukee Prairie State Natural Area,,,,,01N,23E,31,,,,,,,,Nodding Ladies' Tresses [mixed collection with v0020278WIS],,42.50015862,-87.82359307,,,,"Latitude/Longitude was derived from the Township, Range, Section location. This causes an imprecision.",,"GEODISC 2.1 WI Dept. of Natl. Res., Geographic Services Section",1138,m,Spiranthes cernua,No
v0020277WIS,Orchidaceae,Spiranthes,cernua,,,,,"Hapeman, Jeffery",1/24/96,"Hujik, Peter",204a,9/11/93,1993,9,11,United States,Wisconsin,Kenosha,Chiwaukee Prairie,Chiwaukee Prairie State Natural Area,,,,,01N,23E,31,,,,,,,,Nodding Ladies' Tresses [mixed collection with v0020278WIS],,42.50015862,-87.82359307,,,,"Latitude/Longitude was derived from the Township, Range, Section location. This causes an imprecision.",,"GEODISC 2.1 WI Dept. of Natl. Res., Geographic Services Section",1138,m,Spiranthes cernua,No
v0020277WIS,Orchidaceae,Spiranthes,cernua,,,,,"Hapeman, Jeffery",1/24/96,"Hujik, Peter",204a,9/11/93,1993,9,11,United States,Wisconsin,Kenosha,Chiwaukee Prairie,Chiwaukee Prairie State Natural Area,,,,,01N,23E,31,,,,,,,,Nodding Ladies' Tresses [mixed collection with v0020278WIS],,42.50015862,-87.82359307,,,,"Latitude/Longitude was derived from the Township, Range, Section location. This causes an imprecision.",,"GEODISC 2.1 WI Dept. of Natl. Res., Geographic Services Section",1138,m,Spiranthes cernua,No
v0020277WIS,Orchidaceae,Spiranthes,cernua,,,,,"Hapeman, Jeffery",1/24/96,"Hujik, Peter",204a,9/11/93,1993,9,11,United States,Wisconsin,Kenosha,Chiwaukee Prairie,Chiwaukee Prairie State Natural Area,,,,,01N,23E,31,,,,,,,,Nodding Ladies' Tresses [mixed collection with v0020278WIS],,42.50015862,-87.82359307,,,,"Latitude/Longitude was derived from the Township, Range, Section location. This causes an imprecision.",,"GEODISC 2.1 WI Dept. of Natl. Res., Geographic Services Section",1138,m,Spiranthes cernua,No
v0020277WIS,Orchidaceae,Spiranthes,cernua,,,,,"Hapeman, Jeffery",1/24/96,"Hujik, Peter",204a,9/11/93,1993,9,11,United States,Wisconsin,Kenosha,Chiwaukee Prairie,Chiwaukee Prairie State Natural Area,,,,,01N,23E,31,,,,,,,,Nodding Ladies' Tresses [mixed collection with v0020278WIS],,42.50015862,-87.82359307,,,,"Latitude/Longitude was derived from the Township, Range, Section location. This causes an imprecision.",,"GEODISC 2.1 WI Dept. of Natl. Res., Geographic Services Section",1138,m,Spiranthes cernua,No
v0020277WIS,Orchidaceae,Spiranthes,cernua,,,,,"Hapeman, Jeffery",1/24/96,"Hujik, Peter",204a,9/11/93,1993,9,11,United States,Wisconsin,Kenosha,Chiwaukee Prairie,Chiwaukee Prairie State Natural Area,,,,,01N,23E,31,,,,,,,,Nodding Ladies' Tresses [mixed collection with v0020278WIS],,42.50015862,-87.82359307,,,,"Latitude/Longitude was derived from the Township, Range, Section location. This causes an imprecision.",,"GEODISC 2.1 WI Dept. of Natl. Res., Geographic Services Section",1138,m,Spiranthes cernua,No
v0020277WIS,Orchidaceae,Spiranthes,cernua,,,,,"Hapeman, Jeffery",1/24/96,"Hujik, Peter",204a,9/11/93,1993,9,11,United States,Wisconsin,Kenosha,Chiwaukee Prairie,Chiwaukee Prairie State Natural Area,,,,,01N,23E,31,,,,,,,,Nodding Ladies' Tresses [mixed collection with v0020278WIS],,42.50015862,-87.82359307,,,,"Latitude/Longitude was derived from the Township, Range, Section location. This causes an imprecision.",,"GEODISC 2.1 WI Dept. of Natl. Res., Geographic Services Section",1138,m,Spiranthes cernua,No
v0020277WIS,Orchidaceae,Spiranthes,cernua,,,,,"Hapeman, Jeffery",1/24/96,"Hujik, Peter",204a,9/11/93,1993,9,11,United States,Wisconsin,Kenosha,Chiwaukee Prairie,Chiwaukee Prairie State Natural Area,,,,,01N,23E,31,,,,,,,,Nodding Ladies' Tresses [mixed collection with v0020278WIS],,42.50015862,-87.82359307,,,,"Latitude/Longitude was derived from the Township, Range, Section location. This causes an imprecision.",,"GEODISC 2.1 WI Dept. of Natl. Res., Geographic Services Section",1138,m,Spiranthes cernua,No
v0020277WIS,Orchidaceae,Spiranthes,cernua,,,,,"Hapeman, Jeffery",1/24/96,"Hujik, Peter",204a,9/11/93,1993,9,11,United States,Wisconsin,Kenosha,Chiwaukee Prairie,Chiwaukee Prairie State Natural Area,,,,,01N,23E,31,,,,,,,,Nodding Ladies' Tresses [mixed collection with v0020278WIS],,42.50015862,-87.82359307,,,,"Latitude/Longitude was derived from the Township, Range, Section location. This causes an imprecision.",,"GEODISC 2.1 WI Dept. of Natl. Res., Geographic Services Section",1138,m,Spiranthes cernua,No
v0020277WIS,Orchidaceae,Spiranthes,cernua,,,,,"Hapeman, Jeffery",1/24/96,"Hujik, Peter",204a,9/11/93,1993,9,11,United States,Wisconsin,Kenosha,Chiwaukee Prairie,Chiwaukee Prairie State Natural Area,,,,,01N,23E,31,,,,,,,,Nodding Ladies' Tresses [mixed collection with v0020278WIS],,42.50015862,-87.82359307,,,,"Latitude/Longitude was derived from the Township, Range, Section location. This causes an imprecision.",,"GEODISC 2.1 WI Dept. of Natl. Res., Geographic Services Section",1138,m,Spiranthes cernua,No
v0020277WIS,Orchidaceae,Spiranthes,cernua,,,,,"Hapeman, Jeffery",1/24/96,"Hujik, Peter",204a,9/11/93,1993,9,11,United States,Wisconsin,Kenosha,Chiwaukee Prairie,Chiwaukee Prairie State Natural Area,,,,,01N,23E,31,,,,,,,,Nodding Ladies' Tresses [mixed collection with v0020278WIS],,42.50015862,-87.82359307,,,,"Latitude/Longitude was derived from the Township, Range, Section location. This causes an imprecision.",,"GEODISC 2.1 WI Dept. of Natl. Res., Geographic Services Section",1138,m,Spiranthes cernua,No
v0020277WIS,Orchidaceae,Spiranthes,cernua,,,,,"Hapeman, Jeffery",1/24/96,"Hujik, Peter",204a,9/11/93,1993,9,11,United States,Wisconsin,Kenosha,Chiwaukee Prairie,Chiwaukee Prairie State Natural Area,,,,,01N,23E,31,,,,,,,,Nodding Ladies' Tresses [mixed collection with v0020278WIS],,42.50015862,-87.82359307,,,,"Latitude/Longitude was derived from the Township, Range, Section location. This causes an imprecision.",,"GEODISC 2.1 WI Dept. of Natl. Res., Geographic Services Section",1138,m,Spiranthes cernua,No
v0020277WIS,Orchidaceae,Spiranthes,cernua,,,,,"Hapeman, Jeffery",1/24/96,"Hujik, Peter",204a,9/11/93,1993,9,11,United States,Wisconsin,Kenosha,Chiwaukee Prairie,Chiwaukee Prairie State Natural Area,,,,,01N,23E,31,,,,,,,,Nodding Ladies' Tresses [mixed collection with v0020278WIS],,42.50015862,-87.82359307,,,,"Latitude/Longitude was derived from the Township, Range, Section location. This causes an imprecision.",,"GEODISC 2.1 WI Dept. of Natl. Res., Geographic Services Section",1138,m,Spiranthes cernua,No
v0020277WIS,Orchidaceae,Spiranthes,cernua,,,,,"Hapeman, Jeffery",1/24/96,"Hujik, Peter",204a,9/11/93,1993,9,11,United States,Wisconsin,Kenosha,Chiwaukee Prairie,Chiwaukee Prairie State Natural Area,,,,,01N,23E,31,,,,,,,,Nodding Ladies' Tresses [mixed collection with v0020278WIS],,42.50015862,-87.82359307,,,,"Latitude/Longitude was derived from the Township, Range, Section location. This causes an imprecision.",,"GEODISC 2.1 WI Dept. of Natl. Res., Geographic Services Section",1138,m,Spiranthes cernua,No
v0020277WIS,Orchidaceae,Spiranthes,cernua,,,,,"Hapeman, Jeffery",1/24/96,"Hujik, Peter",204a,9/11/93,1993,9,11,United States,Wisconsin,Kenosha,Chiwaukee Prairie,Chiwaukee Prairie State Natural Area,,,,,01N,23E,31,,,,,,,,Nodding Ladies' Tresses [mixed collection with v0020278WIS],,42.50015862,-87.82359307,,,,"Latitude/Longitude was derived from the Township, Range, Section location. This causes an imprecision.",,"GEODISC 2.1 WI Dept. of Natl. Res., Geographic Services Section",1138,m,Spiranthes cernua,No
v0020277WIS,Orchidaceae,Spiranthes,cernua,,,,,"Hapeman, Jeffery",1/24/96,"Hujik, Peter",204a,9/11/93,1993,9,11,United States,Wisconsin,Kenosha,Chiwaukee Prairie,Chiwaukee Prairie State Natural Area,,,,,01N,23E,31,,,,,,,,Nodding Ladies' Tresses [mixed collection with v0020278WIS],,42.50015862,-87.82359307,,,,"Latitude/Longitude was derived from the Township, Range, Section location. This causes an imprecision.",,"GEODISC 2.1 WI Dept. of Natl. Res., Geographic Services Section",1138,m,Spiranthes cernua,No
v0020277WIS,Orchidaceae,Spiranthes,cernua,,,,,"Hapeman, Jeffery",1/24/96,"Hujik, Peter",204a,9/11/93,1993,9,11,United States,Wisconsin,Kenosha,Chiwaukee Prairie,Chiwaukee Prairie State Natural Area,,,,,01N,23E,31,,,,,,,,Nodding Ladies' Tresses [mixed collection with v0020278WIS],,42.50015862,-87.82359307,,,,"Latitude/Longitude was derived from the Township, Range, Section location. This causes an imprecision.",,"GEODISC 2.1 WI Dept. of Natl. Res., Geographic Services Section",1138,m,Spiranthes cernua,No
v0020277WIS,Orchidaceae,Spiranthes,cernua,,,,,"Hapeman, Jeffery",1/24/96,"Hujik, Peter",204a,9/11/93,1993,9,11,United States,Wisconsin,Kenosha,Chiwaukee Prairie,Chiwaukee Prairie State Natural Area,,,,,01N,23E,31,,,,,,,,Nodding Ladies' Tresses [mixed collection with v0020278WIS],,42.50015862,-87.82359307,,,,"Latitude/Longitude was derived from the Township, Range, Section location. This causes an imprecision.",,"GEODISC 2.1 WI Dept. of Natl. Res., Geographic Services Section",1138,m,Spiranthes cernua,No
v0020277WIS,Orchidaceae,Spiranthes,cernua,,,,,"Hapeman, Jeffery",1/24/96,"Hujik, Peter",204a,9/11/93,1993,9,11,United States,Wisconsin,Kenosha,Chiwaukee Prairie,Chiwaukee Prairie State Natural Area,,,,,01N,23E,31,,,,,,,,Nodding Ladies' Tresses [mixed collection with v0020278WIS],,42.50015862,-87.82359307,,,,"Latitude/Longitude was derived from the Township, Range, Section location. This causes an imprecision.",,"GEODISC 2.1 WI Dept. of Natl. Res., Geographic Services Section",1138,m,Spiranthes cernua,No
v0020277WIS,Orchidaceae,Spiranthes,cernua,,,,,"Hapeman, Jeffery",1/24/96,"Hujik, Peter",204a,9/11/93,1993,9,11,United States,Wisconsin,Kenosha,Chiwaukee Prairie,Chiwaukee Prairie State Natural Area,,,,,01N,23E,31,,,,,,,,Nodding Ladies' Tresses [mixed collection with v0020278WIS],,42.50015862,-87.82359307,,,,"Latitude/Longitude was derived from the Township, Range, Section location. This causes an imprecision.",,"GEODISC 2.1 WI Dept. of Natl. Res., Geographic Services Section",1138,m,Spiranthes cernua,No
v0020277WIS,Orchidaceae,Spiranthes,cernua,,,,,"Hapeman, Jeffery",1/24/96,"Hujik, Peter",204a,9/11/93,1993,9,11,United States,Wisconsin,Kenosha,Chiwaukee Prairie,Chiwaukee Prairie State Natural Area,,,,,01N,23E,31,,,,,,,,Nodding Ladies' Tresses [mixed collection with v0020278WIS],,42.50015862,-87.82359307,,,,"Latitude/Longitude was derived from the Township, Range, Section location. This causes an imprecision.",,"GEODISC 2.1 WI Dept. of Natl. Res., Geographic Services Section",1138,m,Spiranthes cernua,No
v0020277WIS,Orchidaceae,Spiranthes,cernua,,,,,"Hapeman, Jeffery",1/24/96,"Hujik, Peter",204a,9/11/93,1993,9,11,United States,Wisconsin,Kenosha,Chiwaukee Prairie,Chiwaukee Prairie State Natural Area,,,,,01N,23E,31,,,,,,,,Nodding Ladies' Tresses [mixed collection with v0020278WIS],,42.50015862,-87.82359307,,,,"Latitude/Longitude was derived from the Township, Range, Section location. This causes an imprecision.",,"GEODISC 2.1 WI Dept. of Natl. Res., Geographic Services Section",1138,m,Spiranthes cernua,No
v0020277WIS,Orchidaceae,Spiranthes,cernua,,,,,"Hapeman, Jeffery",1/24/96,"Hujik, Peter",204a,9/11/93,1993,9,11,United States,Wisconsin,Kenosha,Chiwaukee Prairie,Chiwaukee Prairie State Natural Area,,,,,01N,23E,31,,,,,,,,Nodding Ladies' Tresses [mixed collection with v0020278WIS],,42.50015862,-87.82359307,,,,"Latitude/Longitude was derived from the Township, Range, Section location. This causes an imprecision.",,"GEODISC 2.1 WI Dept. of Natl. Res., Geographic Services Section",1138,m,Spiranthes cernua,No
v0020277WIS,Orchidaceae,Spiranthes,cernua,,,,,"Hapeman, Jeffery",1/24/96,"Hujik, Peter",204a,9/11/93,1993,9,11,United States,Wisconsin,Kenosha,Chiwaukee Prairie,Chiwaukee Prairie State Natural Area,,,,,01N,23E,31,,,,,,,,Nodding Ladies' Tresses [mixed collection with v0020278WIS],,42.50015862,-87.82359307,,,,"Latitude/Longitude was derived from the Township, Range, Section location. This causes an imprecision.",,"GEODISC 2.1 WI Dept. of Natl. Res., Geographic Services Section",1138,m,Spiranthes cernua,No
v0020277WIS,Orchidaceae,Spiranthes,cernua,,,,,"Hapeman, Jeffery",1/24/96,"Hujik, Peter",204a,9/11/93,1993,9,11,United States,Wisconsin,Kenosha,Chiwaukee Prairie,Chiwaukee Prairie State Natural Area,,,,,01N,23E,31,,,,,,,,Nodding Ladies' Tresses [mixed collection with v0020278WIS],,42.50015862,-87.82359307,,,,"Latitude/Longitude was derived from the Township, Range, Section location. This causes an imprecision.",,"GEODISC 2.1 WI Dept. of Natl. Res., Geographic Services Section",1138,m,Spiranthes cernua,No
